
############################################################################
Device Model:     TOSHIBA HDWR480
Serial Number:    X1D0A17KFR2H
smartctl 7.1 2019-12-30 r5022 [x86_64-linux-5.15.0-122-generic] (local build)
Copyright (C) 2002-19, Bruce Allen, Christian Franke, www.smartmontools.org

=== START OF READ SMART DATA SECTION ===
SMART Attributes Data Structure revision number: 16
Vendor Specific SMART Attributes with Thresholds:
ID# ATTRIBUTE_NAME          FLAG     VALUE WORST THRESH TYPE      UPDATED  WHEN_FAILED RAW_VALUE
  1 Raw_Read_Error_Rate     0x000b   100   100   050    Pre-fail  Always       -       0
  2 Throughput_Performance  0x0005   100   100   050    Pre-fail  Offline      -       0
  3 Spin_Up_Time            0x0027   100   100   001    Pre-fail  Always       -       6212
  4 Start_Stop_Count        0x0032   100   100   000    Old_age   Always       -       621
  5 Reallocated_Sector_Ct   0x0033   100   100   050    Pre-fail  Always       -       0
  7 Seek_Error_Rate         0x000b   100   100   050    Pre-fail  Always       -       0
  8 Seek_Time_Performance   0x0005   100   100   050    Pre-fail  Offline      -       0
  9 Power_On_Hours          0x0032   042   042   000    Old_age   Always       -       23373
 10 Spin_Retry_Count        0x0033   100   100   030    Pre-fail  Always       -       0
 12 Power_Cycle_Count       0x0032   100   100   000    Old_age   Always       -       621
191 G-Sense_Error_Rate      0x0032   100   100   000    Old_age   Always       -       0
192 Power-Off_Retract_Count 0x0032   099   099   000    Old_age   Always       -       609
193 Load_Cycle_Count        0x0032   100   100   000    Old_age   Always       -       8630
194 Temperature_Celsius     0x0022   100   100   000    Old_age   Always       -       33 (Min/Max 22/52)
196 Reallocated_Event_Count 0x0032   100   100   000    Old_age   Always       -       0
197 Current_Pending_Sector  0x0032   100   100   000    Old_age   Always       -       0
198 Offline_Uncorrectable   0x0030   100   100   000    Old_age   Offline      -       0
199 UDMA_CRC_Error_Count    0x0032   200   200   000    Old_age   Always       -       0
220 Disk_Shift              0x0002   100   100   000    Old_age   Always       -       17956865
222 Loaded_Hours            0x0032   088   088   000    Old_age   Always       -       5178
223 Load_Retry_Count        0x0032   100   100   000    Old_age   Always       -       0
224 Load_Friction           0x0022   100   100   000    Old_age   Always       -       0
226 Load-in_Time            0x0026   100   100   000    Old_age   Always       -       509
240 Head_Flying_Hours       0x0001   100   100   001    Pre-fail  Offline      -       0


############################################################################
Device Model:     TOSHIBA HDWG480
Serial Number:    Z1D0A08GFR0H
smartctl 7.1 2019-12-30 r5022 [x86_64-linux-5.15.0-122-generic] (local build)
Copyright (C) 2002-19, Bruce Allen, Christian Franke, www.smartmontools.org

=== START OF READ SMART DATA SECTION ===
SMART Attributes Data Structure revision number: 16
Vendor Specific SMART Attributes with Thresholds:
ID# ATTRIBUTE_NAME          FLAG     VALUE WORST THRESH TYPE      UPDATED  WHEN_FAILED RAW_VALUE
  1 Raw_Read_Error_Rate     0x000b   100   100   050    Pre-fail  Always       -       0
  2 Throughput_Performance  0x0005   100   100   050    Pre-fail  Offline      -       0
  3 Spin_Up_Time            0x0027   100   100   001    Pre-fail  Always       -       6026
  4 Start_Stop_Count        0x0032   100   100   000    Old_age   Always       -       1584
  5 Reallocated_Sector_Ct   0x0033   100   100   050    Pre-fail  Always       -       0
  7 Seek_Error_Rate         0x000b   100   099   050    Pre-fail  Always       -       0
  8 Seek_Time_Performance   0x0005   100   100   050    Pre-fail  Offline      -       0
  9 Power_On_Hours          0x0032   063   063   000    Old_age   Always       -       14817
 10 Spin_Retry_Count        0x0033   100   100   030    Pre-fail  Always       -       0
 12 Power_Cycle_Count       0x0032   100   100   000    Old_age   Always       -       1584
191 G-Sense_Error_Rate      0x0032   100   100   000    Old_age   Always       -       0
192 Power-Off_Retract_Count 0x0032   097   097   000    Old_age   Always       -       1578
193 Load_Cycle_Count        0x0032   100   100   000    Old_age   Always       -       6469
194 Temperature_Celsius     0x0022   100   100   000    Old_age   Always       -       34 (Min/Max 23/58)
196 Reallocated_Event_Count 0x0032   100   100   000    Old_age   Always       -       0
197 Current_Pending_Sector  0x0032   100   100   000    Old_age   Always       -       0
198 Offline_Uncorrectable   0x0030   100   100   000    Old_age   Offline      -       0
199 UDMA_CRC_Error_Count    0x0032   200   200   000    Old_age   Always       -       0
220 Disk_Shift              0x0002   100   100   000    Old_age   Always       -       1
222 Loaded_Hours            0x0032   084   084   000    Old_age   Always       -       6525
223 Load_Retry_Count        0x0032   100   100   000    Old_age   Always       -       0
224 Load_Friction           0x0022   100   100   000    Old_age   Always       -       0
226 Load-in_Time            0x0026   100   100   000    Old_age   Always       -       513
240 Head_Flying_Hours       0x0001   100   100   001    Pre-fail  Offline      -       0


############################################################################
Model Family:     Phison Driven SSDs
Device Model:     KINGSTON SA400S37240G
Serial Number:    50026B77841B384A
smartctl 7.1 2019-12-30 r5022 [x86_64-linux-5.15.0-122-generic] (local build)
Copyright (C) 2002-19, Bruce Allen, Christian Franke, www.smartmontools.org

=== START OF READ SMART DATA SECTION ===
SMART Attributes Data Structure revision number: 1
Vendor Specific SMART Attributes with Thresholds:
ID# ATTRIBUTE_NAME          FLAG     VALUE WORST THRESH TYPE      UPDATED  WHEN_FAILED RAW_VALUE
  1 Raw_Read_Error_Rate     0x0032   100   100   000    Old_age   Always       -       100
  9 Power_On_Hours          0x0032   100   100   000    Old_age   Always       -       30669
 12 Power_Cycle_Count       0x0032   100   100   000    Old_age   Always       -       106
148 Unknown_Attribute       0x0000   100   100   000    Old_age   Offline      -       0
149 Unknown_Attribute       0x0000   100   100   000    Old_age   Offline      -       0
167 Write_Protect_Mode      0x0000   100   100   000    Old_age   Offline      -       0
168 SATA_Phy_Error_Count    0x0012   100   100   000    Old_age   Always       -       0
169 Bad_Block_Rate          0x0000   100   100   000    Old_age   Offline      -       0
170 Bad_Blk_Ct_Erl/Lat      0x0000   100   100   010    Old_age   Offline      -       0/0
172 Erase_Fail_Count        0x0032   100   100   000    Old_age   Always       -       0
173 MaxAvgErase_Ct          0x0000   100   100   000    Old_age   Offline      -       0
181 Program_Fail_Count      0x0032   100   100   000    Old_age   Always       -       0
182 Erase_Fail_Count        0x0000   100   100   000    Old_age   Offline      -       0
187 Reported_Uncorrect      0x0032   100   100   000    Old_age   Always       -       0
192 Unsafe_Shutdown_Count   0x0012   100   100   000    Old_age   Always       -       45
194 Temperature_Celsius     0x0022   038   061   000    Old_age   Always       -       38 (Min/Max 22/61)
196 Reallocated_Event_Count 0x0032   100   100   000    Old_age   Always       -       0
199 SATA_CRC_Error_Count    0x0032   100   100   000    Old_age   Always       -       0
218 CRC_Error_Count         0x0032   100   100   000    Old_age   Always       -       0
231 SSD_Life_Left           0x0000   083   083   000    Old_age   Offline      -       83
233 Flash_Writes_GiB        0x0032   100   100   000    Old_age   Always       -       10104
241 Lifetime_Writes_GiB     0x0032   100   100   000    Old_age   Always       -       20551
242 Lifetime_Reads_GiB      0x0032   100   100   000    Old_age   Always       -       8713
244 Average_Erase_Count     0x0000   100   100   000    Old_age   Offline      -       172
245 Max_Erase_Count         0x0000   100   100   000    Old_age   Offline      -       191
246 Total_Erase_Count       0x0000   100   100   000    Old_age   Offline      -       157696


Verificacao concluida em 07-2025!
