
############################################################################
Model Family:     Toshiba P300 (CMR)
Device Model:     TOSHIBA HDWD110
Serial Number:    126T2UUMS
smartctl 7.4 2023-08-01 r5530 [x86_64-linux-6.8.0-62-generic] (local build)
Copyright (C) 2002-23, Bruce Allen, Christian Franke, www.smartmontools.org

=== START OF READ SMART DATA SECTION ===
SMART Attributes Data Structure revision number: 16
Vendor Specific SMART Attributes with Thresholds:
ID# ATTRIBUTE_NAME          FLAG     VALUE WORST THRESH TYPE      UPDATED  WHEN_FAILED RAW_VALUE
  1 Raw_Read_Error_Rate     0x000b   100   100   016    Pre-fail  Always       -       0
  2 Throughput_Performance  0x0005   142   142   054    Pre-fail  Offline      -       70
  3 Spin_Up_Time            0x0007   126   126   024    Pre-fail  Always       -       184 (Average 180)
  4 Start_Stop_Count        0x0012   100   100   000    Old_age   Always       -       86
  5 Reallocated_Sector_Ct   0x0033   100   100   005    Pre-fail  Always       -       0
  7 Seek_Error_Rate         0x000b   100   100   067    Pre-fail  Always       -       0
  8 Seek_Time_Performance   0x0005   115   115   020    Pre-fail  Offline      -       34
  9 Power_On_Hours          0x0012   098   098   000    Old_age   Always       -       19910
 10 Spin_Retry_Count        0x0013   100   100   060    Pre-fail  Always       -       0
 12 Power_Cycle_Count       0x0032   100   100   000    Old_age   Always       -       86
192 Power-Off_Retract_Count 0x0032   100   100   000    Old_age   Always       -       123
193 Load_Cycle_Count        0x0012   100   100   000    Old_age   Always       -       123
194 Temperature_Celsius     0x0002   153   153   000    Old_age   Always       -       39 (Min/Max 25/45)
196 Reallocated_Event_Count 0x0032   100   100   000    Old_age   Always       -       0
197 Current_Pending_Sector  0x0022   100   100   000    Old_age   Always       -       0
198 Offline_Uncorrectable   0x0008   100   100   000    Old_age   Offline      -       0
199 UDMA_CRC_Error_Count    0x000a   200   200   000    Old_age   Always       -       0


############################################################################
Model Family:     Seagate Constellation ES (SATA 6Gb/s)
Device Model:     ST1000NM0011
Serial Number:    Z1N3REKR
smartctl 7.4 2023-08-01 r5530 [x86_64-linux-6.8.0-62-generic] (local build)
Copyright (C) 2002-23, Bruce Allen, Christian Franke, www.smartmontools.org

=== START OF READ SMART DATA SECTION ===
SMART Attributes Data Structure revision number: 10
Vendor Specific SMART Attributes with Thresholds:
ID# ATTRIBUTE_NAME          FLAG     VALUE WORST THRESH TYPE      UPDATED  WHEN_FAILED RAW_VALUE
  1 Raw_Read_Error_Rate     0x000f   081   063   044    Pre-fail  Always       -       129524525
  3 Spin_Up_Time            0x0003   095   094   000    Pre-fail  Always       -       0
  4 Start_Stop_Count        0x0032   100   100   020    Old_age   Always       -       350
  5 Reallocated_Sector_Ct   0x0033   100   100   036    Pre-fail  Always       -       4
  7 Seek_Error_Rate         0x000f   093   060   030    Pre-fail  Always       -       2383509702
  9 Power_On_Hours          0x0032   074   011   000    Old_age   Always       -       23314
 10 Spin_Retry_Count        0x0013   100   100   097    Pre-fail  Always       -       0
 12 Power_Cycle_Count       0x0032   100   100   020    Old_age   Always       -       352
184 End-to-End_Error        0x0032   100   100   099    Old_age   Always       -       0
187 Reported_Uncorrect      0x0032   100   100   000    Old_age   Always       -       0
188 Command_Timeout         0x0032   100   100   000    Old_age   Always       -       0
189 High_Fly_Writes         0x003a   100   100   000    Old_age   Always       -       0
190 Airflow_Temperature_Cel 0x0022   065   054   045    Old_age   Always       -       35 (Min/Max 31/42)
191 G-Sense_Error_Rate      0x0032   100   100   000    Old_age   Always       -       0
192 Power-Off_Retract_Count 0x0032   100   100   000    Old_age   Always       -       256
193 Load_Cycle_Count        0x0032   081   081   000    Old_age   Always       -       39200
194 Temperature_Celsius     0x0022   035   046   000    Old_age   Always       -       35 (0 21 0 0 0)
195 Hardware_ECC_Recovered  0x001a   117   099   000    Old_age   Always       -       129524525
197 Current_Pending_Sector  0x0012   100   100   000    Old_age   Always       -       0
198 Offline_Uncorrectable   0x0010   100   100   000    Old_age   Offline      -       0
199 UDMA_CRC_Error_Count    0x003e   200   200   000    Old_age   Always       -       0
240 Head_Flying_Hours       0x0000   100   253   000    Old_age   Offline      -       57506 (250 172 0)
241 Total_LBAs_Written      0x0000   100   253   000    Old_age   Offline      -       2623143178
242 Total_LBAs_Read         0x0000   100   253   000    Old_age   Offline      -       2696670853


############################################################################
Model Family:     Seagate Constellation ES (SATA 6Gb/s)
Device Model:     ST1000NM0011
Serial Number:    Z1N3RDS1
smartctl 7.4 2023-08-01 r5530 [x86_64-linux-6.8.0-62-generic] (local build)
Copyright (C) 2002-23, Bruce Allen, Christian Franke, www.smartmontools.org

=== START OF READ SMART DATA SECTION ===
SMART Attributes Data Structure revision number: 10
Vendor Specific SMART Attributes with Thresholds:
ID# ATTRIBUTE_NAME          FLAG     VALUE WORST THRESH TYPE      UPDATED  WHEN_FAILED RAW_VALUE
  1 Raw_Read_Error_Rate     0x000f   082   063   044    Pre-fail  Always       -       193526308
  3 Spin_Up_Time            0x0003   095   094   000    Pre-fail  Always       -       0
  4 Start_Stop_Count        0x0032   100   100   020    Old_age   Always       -       352
  5 Reallocated_Sector_Ct   0x0033   100   100   036    Pre-fail  Always       -       0
  7 Seek_Error_Rate         0x000f   090   060   030    Pre-fail  Always       -       1136175584
  9 Power_On_Hours          0x0032   070   011   000    Old_age   Always       -       26988
 10 Spin_Retry_Count        0x0013   100   100   097    Pre-fail  Always       -       0
 12 Power_Cycle_Count       0x0032   100   100   020    Old_age   Always       -       353
184 End-to-End_Error        0x0032   100   100   099    Old_age   Always       -       0
187 Reported_Uncorrect      0x0032   100   100   000    Old_age   Always       -       0
188 Command_Timeout         0x0032   100   100   000    Old_age   Always       -       0
189 High_Fly_Writes         0x003a   100   100   000    Old_age   Always       -       0
190 Airflow_Temperature_Cel 0x0022   065   052   045    Old_age   Always       -       35 (Min/Max 30/38)
191 G-Sense_Error_Rate      0x0032   100   100   000    Old_age   Always       -       0
192 Power-Off_Retract_Count 0x0032   100   100   000    Old_age   Always       -       317
193 Load_Cycle_Count        0x0032   076   076   000    Old_age   Always       -       49224
194 Temperature_Celsius     0x0022   035   048   000    Old_age   Always       -       35 (0 20 0 0 0)
195 Hardware_ECC_Recovered  0x001a   118   099   000    Old_age   Always       -       193526308
197 Current_Pending_Sector  0x0012   100   100   000    Old_age   Always       -       0
198 Offline_Uncorrectable   0x0010   100   100   000    Old_age   Offline      -       0
199 UDMA_CRC_Error_Count    0x003e   200   200   000    Old_age   Always       -       0
240 Head_Flying_Hours       0x0000   100   253   000    Old_age   Offline      -       91483 (92 176 0)
241 Total_LBAs_Written      0x0000   100   253   000    Old_age   Offline      -       4142839947
242 Total_LBAs_Read         0x0000   100   253   000    Old_age   Offline      -       2300702969


Verificacao concluida em 07-2025!
