
############################################################################
Device Model:     ST4000NT001-3M2101
Serial Number:    WX10M7H8
smartctl 7.4 2023-08-01 r5530 [x86_64-linux-6.8.0-62-generic] (local build)
Copyright (C) 2002-23, Bruce Allen, Christian Franke, www.smartmontools.org

=== START OF READ SMART DATA SECTION ===
SMART Attributes Data Structure revision number: 10
Vendor Specific SMART Attributes with Thresholds:
ID# ATTRIBUTE_NAME          FLAG     VALUE WORST THRESH TYPE      UPDATED  WHEN_FAILED RAW_VALUE
  1 Raw_Read_Error_Rate     0x000f   084   064   044    Pre-fail  Always       -       235626946
  3 Spin_Up_Time            0x0003   095   092   000    Pre-fail  Always       -       0
  4 Start_Stop_Count        0x0032   100   100   020    Old_age   Always       -       67
  5 Reallocated_Sector_Ct   0x0033   100   100   010    Pre-fail  Always       -       0
  7 Seek_Error_Rate         0x000f   080   060   045    Pre-fail  Always       -       104824041
  9 Power_On_Hours          0x0032   089   089   000    Old_age   Always       -       10488
 10 Spin_Retry_Count        0x0013   100   100   097    Pre-fail  Always       -       0
 12 Power_Cycle_Count       0x0032   100   100   020    Old_age   Always       -       69
 18 Unknown_Attribute       0x000b   100   100   050    Pre-fail  Always       -       0
187 Reported_Uncorrect      0x0032   100   100   000    Old_age   Always       -       0
188 Command_Timeout         0x0032   100   100   000    Old_age   Always       -       0
190 Airflow_Temperature_Cel 0x0022   059   046   000    Old_age   Always       -       41 (Min/Max 37/45)
192 Power-Off_Retract_Count 0x0032   100   100   000    Old_age   Always       -       45
193 Load_Cycle_Count        0x0032   082   082   000    Old_age   Always       -       36314
194 Temperature_Celsius     0x0022   041   054   000    Old_age   Always       -       41 (0 25 0 0 0)
197 Current_Pending_Sector  0x0012   100   100   000    Old_age   Always       -       0
198 Offline_Uncorrectable   0x0010   100   100   000    Old_age   Offline      -       0
199 UDMA_CRC_Error_Count    0x003e   200   200   000    Old_age   Always       -       0
240 Head_Flying_Hours       0x0000   100   253   000    Old_age   Offline      -       2511 (176 16 0)
241 Total_LBAs_Written      0x0000   100   253   000    Old_age   Offline      -       23197583843
242 Total_LBAs_Read         0x0000   100   253   000    Old_age   Offline      -       44522993897


############################################################################
Model Family:     Seagate IronWolf
Device Model:     ST2000VN004-2E4164
Serial Number:    Z52BDJTZ
smartctl 7.4 2023-08-01 r5530 [x86_64-linux-6.8.0-62-generic] (local build)
Copyright (C) 2002-23, Bruce Allen, Christian Franke, www.smartmontools.org

=== START OF READ SMART DATA SECTION ===
SMART Attributes Data Structure revision number: 10
Vendor Specific SMART Attributes with Thresholds:
ID# ATTRIBUTE_NAME          FLAG     VALUE WORST THRESH TYPE      UPDATED  WHEN_FAILED RAW_VALUE
  1 Raw_Read_Error_Rate     0x000f   114   099   006    Pre-fail  Always       -       75858872
  3 Spin_Up_Time            0x0003   096   096   000    Pre-fail  Always       -       0
  4 Start_Stop_Count        0x0032   100   100   020    Old_age   Always       -       115
  5 Reallocated_Sector_Ct   0x0033   100   100   010    Pre-fail  Always       -       0
  7 Seek_Error_Rate         0x000f   083   060   030    Pre-fail  Always       -       231366705
  9 Power_On_Hours          0x0032   066   066   000    Old_age   Always       -       29861
 10 Spin_Retry_Count        0x0013   100   100   097    Pre-fail  Always       -       0
 12 Power_Cycle_Count       0x0032   100   100   020    Old_age   Always       -       116
184 End-to-End_Error        0x0032   100   100   099    Old_age   Always       -       0
187 Reported_Uncorrect      0x0032   100   100   000    Old_age   Always       -       0
188 Command_Timeout         0x0032   100   099   000    Old_age   Always       -       1
189 High_Fly_Writes         0x003a   044   044   000    Old_age   Always       -       56
190 Airflow_Temperature_Cel 0x0022   065   055   045    Old_age   Always       -       35 (Min/Max 33/38)
191 G-Sense_Error_Rate      0x0032   100   100   000    Old_age   Always       -       0
192 Power-Off_Retract_Count 0x0032   100   100   000    Old_age   Always       -       111
193 Load_Cycle_Count        0x0032   100   100   000    Old_age   Always       -       186
194 Temperature_Celsius     0x0022   035   045   000    Old_age   Always       -       35 (0 19 0 0 0)
197 Current_Pending_Sector  0x0012   100   100   000    Old_age   Always       -       0
198 Offline_Uncorrectable   0x0010   100   100   000    Old_age   Offline      -       0
199 UDMA_CRC_Error_Count    0x003e   200   200   000    Old_age   Always       -       0


############################################################################
Model Family:     Seagate IronWolf
Device Model:     ST2000VN004-2E4164
Serial Number:    Z52BDHGR
smartctl 7.4 2023-08-01 r5530 [x86_64-linux-6.8.0-62-generic] (local build)
Copyright (C) 2002-23, Bruce Allen, Christian Franke, www.smartmontools.org

=== START OF READ SMART DATA SECTION ===
SMART Attributes Data Structure revision number: 10
Vendor Specific SMART Attributes with Thresholds:
ID# ATTRIBUTE_NAME          FLAG     VALUE WORST THRESH TYPE      UPDATED  WHEN_FAILED RAW_VALUE
  1 Raw_Read_Error_Rate     0x000f   119   088   006    Pre-fail  Always       -       233484648
  3 Spin_Up_Time            0x0003   096   096   000    Pre-fail  Always       -       0
  4 Start_Stop_Count        0x0032   100   100   020    Old_age   Always       -       108
  5 Reallocated_Sector_Ct   0x0033   100   100   010    Pre-fail  Always       -       0
  7 Seek_Error_Rate         0x000f   083   060   030    Pre-fail  Always       -       211047307
  9 Power_On_Hours          0x0032   066   066   000    Old_age   Always       -       29861
 10 Spin_Retry_Count        0x0013   100   100   097    Pre-fail  Always       -       0
 12 Power_Cycle_Count       0x0032   100   100   020    Old_age   Always       -       109
184 End-to-End_Error        0x0032   100   100   099    Old_age   Always       -       0
187 Reported_Uncorrect      0x0032   100   100   000    Old_age   Always       -       0
188 Command_Timeout         0x0032   100   100   000    Old_age   Always       -       0
189 High_Fly_Writes         0x003a   001   001   000    Old_age   Always       -       133
190 Airflow_Temperature_Cel 0x0022   215   004   045    Old_age   Always   In_the_past 141 (255 255 141 141 0)
191 G-Sense_Error_Rate      0x0032   100   100   000    Old_age   Always       -       0
192 Power-Off_Retract_Count 0x0032   100   100   000    Old_age   Always       -       103
193 Load_Cycle_Count        0x0032   100   100   000    Old_age   Always       -       179
194 Temperature_Celsius     0x0022   141   141   000    Old_age   Always       -       141 (0 19 0 0 0)
197 Current_Pending_Sector  0x0012   100   100   000    Old_age   Always       -       0
198 Offline_Uncorrectable   0x0010   100   100   000    Old_age   Offline      -       0
199 UDMA_CRC_Error_Count    0x003e   200   200   000    Old_age   Always       -       0


############################################################################
Model Family:     Seagate Barracuda 7200.14 (AF)
Device Model:     ST2000DM001-1ER164
Serial Number:    W4Z320XE
smartctl 7.4 2023-08-01 r5530 [x86_64-linux-6.8.0-62-generic] (local build)
Copyright (C) 2002-23, Bruce Allen, Christian Franke, www.smartmontools.org

=== START OF READ SMART DATA SECTION ===
SMART Attributes Data Structure revision number: 10
Vendor Specific SMART Attributes with Thresholds:
ID# ATTRIBUTE_NAME          FLAG     VALUE WORST THRESH TYPE      UPDATED  WHEN_FAILED RAW_VALUE
  1 Raw_Read_Error_Rate     0x000f   118   099   006    Pre-fail  Always       -       171697816
  3 Spin_Up_Time            0x0003   096   096   000    Pre-fail  Always       -       0
  4 Start_Stop_Count        0x0032   094   094   020    Old_age   Always       -       6573
  5 Reallocated_Sector_Ct   0x0033   100   100   010    Pre-fail  Always       -       0
  7 Seek_Error_Rate         0x000f   069   060   030    Pre-fail  Always       -       9772642
  9 Power_On_Hours          0x0032   079   079   000    Old_age   Always       -       18923
 10 Spin_Retry_Count        0x0013   100   100   097    Pre-fail  Always       -       0
 12 Power_Cycle_Count       0x0032   099   099   020    Old_age   Always       -       1805
183 Runtime_Bad_Block       0x0032   100   100   000    Old_age   Always       -       0
184 End-to-End_Error        0x0032   100   100   099    Old_age   Always       -       0
187 Reported_Uncorrect      0x0032   100   100   000    Old_age   Always       -       0
188 Command_Timeout         0x0032   100   094   000    Old_age   Always       -       155 155 435
189 High_Fly_Writes         0x003a   099   099   000    Old_age   Always       -       1
190 Airflow_Temperature_Cel 0x0022   066   055   045    Old_age   Always       -       34 (Min/Max 32/37)
191 G-Sense_Error_Rate      0x0032   100   100   000    Old_age   Always       -       0
192 Power-Off_Retract_Count 0x0032   100   100   000    Old_age   Always       -       74
193 Load_Cycle_Count        0x0032   014   014   000    Old_age   Always       -       173221
194 Temperature_Celsius     0x0022   034   045   000    Old_age   Always       -       34 (0 14 0 0 0)
197 Current_Pending_Sector  0x0012   100   100   000    Old_age   Always       -       0
198 Offline_Uncorrectable   0x0010   100   100   000    Old_age   Offline      -       0
199 UDMA_CRC_Error_Count    0x003e   200   200   000    Old_age   Always       -       0
240 Head_Flying_Hours       0x0000   100   253   000    Old_age   Offline      -       8046h+19m+49.157s
241 Total_LBAs_Written      0x0000   100   253   000    Old_age   Offline      -       7836423494
242 Total_LBAs_Read         0x0000   100   253   000    Old_age   Offline      -       193596386888


############################################################################
Model Family:     Seagate BarraCuda 3.5 (CMR)
Device Model:     ST1000DM010-2EP102
Serial Number:    Z9AH3XZK
smartctl 7.4 2023-08-01 r5530 [x86_64-linux-6.8.0-62-generic] (local build)
Copyright (C) 2002-23, Bruce Allen, Christian Franke, www.smartmontools.org

=== START OF READ SMART DATA SECTION ===
SMART Attributes Data Structure revision number: 10
Vendor Specific SMART Attributes with Thresholds:
ID# ATTRIBUTE_NAME          FLAG     VALUE WORST THRESH TYPE      UPDATED  WHEN_FAILED RAW_VALUE
  1 Raw_Read_Error_Rate     0x000f   080   051   006    Pre-fail  Always       -       117032344
  3 Spin_Up_Time            0x0003   097   097   000    Pre-fail  Always       -       0
  4 Start_Stop_Count        0x0032   099   099   020    Old_age   Always       -       1951
  5 Reallocated_Sector_Ct   0x0033   100   100   010    Pre-fail  Always       -       0
  7 Seek_Error_Rate         0x000f   085   060   045    Pre-fail  Always       -       349542611
  9 Power_On_Hours          0x0032   079   079   000    Old_age   Always       -       18508
 10 Spin_Retry_Count        0x0013   100   100   097    Pre-fail  Always       -       0
 12 Power_Cycle_Count       0x0032   099   099   020    Old_age   Always       -       1926
183 Runtime_Bad_Block       0x0032   100   100   000    Old_age   Always       -       0
184 End-to-End_Error        0x0032   100   100   099    Old_age   Always       -       0
187 Reported_Uncorrect      0x0032   001   001   000    Old_age   Always       -       383
188 Command_Timeout         0x0032   100   099   000    Old_age   Always       -       8 8 8
189 High_Fly_Writes         0x003a   100   100   000    Old_age   Always       -       0
190 Airflow_Temperature_Cel 0x0022   065   046   040    Old_age   Always       -       35 (Min/Max 33/38)
193 Load_Cycle_Count        0x0032   099   099   000    Old_age   Always       -       2159
194 Temperature_Celsius     0x0022   035   013   000    Old_age   Always       -       35 (0 13 0 0 0)
195 Hardware_ECC_Recovered  0x001a   017   001   000    Old_age   Always       -       117032344
197 Current_Pending_Sector  0x0012   100   100   000    Old_age   Always       -       0
198 Offline_Uncorrectable   0x0010   100   100   000    Old_age   Offline      -       0
199 UDMA_CRC_Error_Count    0x003e   200   200   000    Old_age   Always       -       0
240 Head_Flying_Hours       0x0000   100   253   000    Old_age   Offline      -       18452h+58m+58.153s
241 Total_LBAs_Written      0x0000   100   253   000    Old_age   Offline      -       34765561106
242 Total_LBAs_Read         0x0000   100   253   000    Old_age   Offline      -       44660470742


############################################################################
Model Number:                       KINGSTON SKC3000S512G
Serial Number:                      50026B76869038FD
smartctl 7.4 2023-08-01 r5530 [x86_64-linux-6.8.0-62-generic] (local build)
Copyright (C) 2002-23, Bruce Allen, Christian Franke, www.smartmontools.org

=== START OF SMART DATA SECTION ===
SMART/Health Information (NVMe Log 0x02)
Critical Warning:                   0x00
Temperature:                        40 Celsius
Available Spare:                    100%
Available Spare Threshold:          10%
Percentage Used:                    7%
Data Units Read:                    7,923,968 [4.05 TB]
Data Units Written:                 44,738,178 [22.9 TB]
Host Read Commands:                 106,730,533
Host Write Commands:                921,788,530
Controller Busy Time:               7,311
Power Cycles:                       94
Power On Hours:                     10,484
Unsafe Shutdowns:                   63
Media and Data Integrity Errors:    0
Error Information Log Entries:      108
Warning  Comp. Temperature Time:    0
Critical Comp. Temperature Time:    0
Temperature Sensor 2:               63 Celsius


############################################################################
Model Number:                       KINGSTON SKC3000S512G
Serial Number:                      50026B76869038FD
smartctl 7.4 2023-08-01 r5530 [x86_64-linux-6.8.0-62-generic] (local build)
Copyright (C) 2002-23, Bruce Allen, Christian Franke, www.smartmontools.org

=== START OF SMART DATA SECTION ===
SMART/Health Information (NVMe Log 0x02)
Critical Warning:                   0x00
Temperature:                        40 Celsius
Available Spare:                    100%
Available Spare Threshold:          10%
Percentage Used:                    7%
Data Units Read:                    7,923,968 [4.05 TB]
Data Units Written:                 44,738,178 [22.9 TB]
Host Read Commands:                 106,730,533
Host Write Commands:                921,788,530
Controller Busy Time:               7,311
Power Cycles:                       94
Power On Hours:                     10,484
Unsafe Shutdowns:                   63
Media and Data Integrity Errors:    0
Error Information Log Entries:      110
Warning  Comp. Temperature Time:    0
Critical Comp. Temperature Time:    0
Temperature Sensor 2:               63 Celsius


Verificacao concluida em 07-2025!
