
############################################################################
Device Model:     LITEON CV8-CE128-HP
Serial Number:    0019202001LQ
smartctl 7.4 2023-08-01 r5530 [x86_64-linux-6.8.0-62-generic] (local build)
Copyright (C) 2002-23, Bruce Allen, Christian Franke, www.smartmontools.org

=== START OF READ SMART DATA SECTION ===
SMART Attributes Data Structure revision number: 1
Vendor Specific SMART Attributes with Thresholds:
ID# ATTRIBUTE_NAME          FLAG     VALUE WORST THRESH TYPE      UPDATED  WHEN_FAILED RAW_VALUE
  1 Raw_Read_Error_Rate     0x002f   100   100   050    Pre-fail  Always       -       0
  5 Reallocated_Sector_Ct   0x0033   100   100   005    Pre-fail  Always       -       0
  9 Power_On_Hours          0x0032   100   100   000    Old_age   Always       -       9286
 12 Power_Cycle_Count       0x0032   100   100   000    Old_age   Always       -       878
171 Unknown_Attribute       0x0032   100   100   000    Old_age   Always       -       0
172 Unknown_Attribute       0x0032   100   100   000    Old_age   Always       -       0
173 Unknown_Attribute       0x0032   072   072   005    Old_age   Always       -       572
174 Unknown_Attribute       0x0032   100   100   000    Old_age   Always       -       38
176 Erase_Fail_Count_Chip   0x0022   100   100   000    Old_age   Always       -       90
181 Program_Fail_Cnt_Total  0x0022   001   001   000    Old_age   Always       -       0
183 Runtime_Bad_Block       0x0032   100   100   000    Old_age   Always       -       0
184 End-to-End_Error        0x003b   100   100   097    Pre-fail  Always       -       0
187 Reported_Uncorrect      0x0032   100   100   000    Old_age   Always       -       0
188 Command_Timeout         0x0032   100   100   000    Old_age   Always       -       0
194 Temperature_Celsius     0x0022   034   053   000    Old_age   Always       -       34 (Min/Max 25/38)
198 Offline_Uncorrectable   0x0030   100   100   000    Old_age   Offline      -       0
199 UDMA_CRC_Error_Count    0x0032   100   100   000    Old_age   Always       -       0
201 Unknown_SSD_Attribute   0x0023   072   072   005    Pre-fail  Always       -       1428
241 Total_LBAs_Written      0x0032   100   100   000    Old_age   Always       -       2027499
242 Total_LBAs_Read         0x0032   100   100   000    Old_age   Always       -       8637691
243 Unknown_Attribute       0x0032   100   100   000    Old_age   Always       -       4815658


############################################################################
Model Family:     Seagate BarraCuda 3.5 (SMR)
Device Model:     ST4000DM004-2U9104
Serial Number:    ZFN4NWH3
smartctl 7.4 2023-08-01 r5530 [x86_64-linux-6.8.0-62-generic] (local build)
Copyright (C) 2002-23, Bruce Allen, Christian Franke, www.smartmontools.org

=== START OF READ SMART DATA SECTION ===
SMART Attributes Data Structure revision number: 10
Vendor Specific SMART Attributes with Thresholds:
ID# ATTRIBUTE_NAME          FLAG     VALUE WORST THRESH TYPE      UPDATED  WHEN_FAILED RAW_VALUE
  1 Raw_Read_Error_Rate     0x000f   083   064   006    Pre-fail  Always       -       193169072
  3 Spin_Up_Time            0x0003   096   096   000    Pre-fail  Always       -       0
  4 Start_Stop_Count        0x0032   100   100   020    Old_age   Always       -       29
  5 Reallocated_Sector_Ct   0x0033   100   100   010    Pre-fail  Always       -       0
  7 Seek_Error_Rate         0x000f   085   060   045    Pre-fail  Always       -       292410688
  9 Power_On_Hours          0x0032   083   083   000    Old_age   Always       -       15312h+13m+46.266s
 10 Spin_Retry_Count        0x0013   100   100   097    Pre-fail  Always       -       0
 12 Power_Cycle_Count       0x0032   100   100   020    Old_age   Always       -       27
183 Runtime_Bad_Block       0x0032   100   100   000    Old_age   Always       -       0
184 End-to-End_Error        0x0032   100   100   099    Old_age   Always       -       0
187 Reported_Uncorrect      0x0032   100   100   000    Old_age   Always       -       0
188 Command_Timeout         0x0032   100   100   000    Old_age   Always       -       0 0 0
189 High_Fly_Writes         0x003a   100   100   000    Old_age   Always       -       0
190 Airflow_Temperature_Cel 0x0022   059   051   040    Old_age   Always       -       41 (Min/Max 36/43)
191 G-Sense_Error_Rate      0x0032   100   100   000    Old_age   Always       -       0
192 Power-Off_Retract_Count 0x0032   100   100   000    Old_age   Always       -       93
193 Load_Cycle_Count        0x0032   096   096   000    Old_age   Always       -       9499
194 Temperature_Celsius     0x0022   041   049   000    Old_age   Always       -       41 (0 29 0 0 0)
195 Hardware_ECC_Recovered  0x001a   083   064   000    Old_age   Always       -       193169072
197 Current_Pending_Sector  0x0012   100   100   000    Old_age   Always       -       0
198 Offline_Uncorrectable   0x0010   100   100   000    Old_age   Offline      -       0
199 UDMA_CRC_Error_Count    0x003e   200   200   000    Old_age   Always       -       0
240 Head_Flying_Hours       0x0000   100   253   000    Old_age   Offline      -       14152h+36m+55.895s
241 Total_LBAs_Written      0x0000   100   253   000    Old_age   Offline      -       13314158023
242 Total_LBAs_Read         0x0000   100   253   000    Old_age   Offline      -       84667677723


############################################################################
Model Family:     Seagate BarraCuda 3.5 (SMR)
Device Model:     ST4000DM004-2U9104
Serial Number:    ZW60F20M
smartctl 7.4 2023-08-01 r5530 [x86_64-linux-6.8.0-62-generic] (local build)
Copyright (C) 2002-23, Bruce Allen, Christian Franke, www.smartmontools.org

=== START OF READ SMART DATA SECTION ===
SMART Attributes Data Structure revision number: 10
Vendor Specific SMART Attributes with Thresholds:
ID# ATTRIBUTE_NAME          FLAG     VALUE WORST THRESH TYPE      UPDATED  WHEN_FAILED RAW_VALUE
  1 Raw_Read_Error_Rate     0x000f   100   064   006    Pre-fail  Always       -       36
  3 Spin_Up_Time            0x0003   096   096   000    Pre-fail  Always       -       0
  4 Start_Stop_Count        0x0032   100   100   020    Old_age   Always       -       29
  5 Reallocated_Sector_Ct   0x0033   100   100   010    Pre-fail  Always       -       0
  7 Seek_Error_Rate         0x000f   083   060   045    Pre-fail  Always       -       215469457
  9 Power_On_Hours          0x0032   083   083   000    Old_age   Always       -       15312h+10m+13.797s
 10 Spin_Retry_Count        0x0013   100   100   097    Pre-fail  Always       -       0
 12 Power_Cycle_Count       0x0032   100   100   020    Old_age   Always       -       27
183 Runtime_Bad_Block       0x0032   100   100   000    Old_age   Always       -       0
184 End-to-End_Error        0x0032   100   100   099    Old_age   Always       -       0
187 Reported_Uncorrect      0x0032   100   100   000    Old_age   Always       -       0
188 Command_Timeout         0x0032   100   100   000    Old_age   Always       -       0 0 0
189 High_Fly_Writes         0x003a   100   100   000    Old_age   Always       -       0
190 Airflow_Temperature_Cel 0x0022   057   051   040    Old_age   Always       -       43 (Min/Max 37/47)
191 G-Sense_Error_Rate      0x0032   100   100   000    Old_age   Always       -       0
192 Power-Off_Retract_Count 0x0032   100   100   000    Old_age   Always       -       36
193 Load_Cycle_Count        0x0032   088   088   000    Old_age   Always       -       24979
194 Temperature_Celsius     0x0022   043   049   000    Old_age   Always       -       43 (0 29 0 0 0)
195 Hardware_ECC_Recovered  0x001a   100   064   000    Old_age   Always       -       36
197 Current_Pending_Sector  0x0012   100   100   000    Old_age   Always       -       0
198 Offline_Uncorrectable   0x0010   100   100   000    Old_age   Offline      -       0
199 UDMA_CRC_Error_Count    0x003e   200   200   000    Old_age   Always       -       0
240 Head_Flying_Hours       0x0000   100   253   000    Old_age   Offline      -       12128h+54m+07.794s
241 Total_LBAs_Written      0x0000   100   253   000    Old_age   Offline      -       31838003807
242 Total_LBAs_Read         0x0000   100   253   000    Old_age   Offline      -       13987013951


############################################################################
Device Model:     [No Information Found]
Serial Number:    [No Information Found]
smartctl 7.4 2023-08-01 r5530 [x86_64-linux-6.8.0-62-generic] (local build)
Copyright (C) 2002-23, Bruce Allen, Christian Franke, www.smartmontools.org

Read Device Identity failed: scsi error unsupported field in scsi command

If this is a USB connected device, look at the various --device=TYPE variants
SMART support is: Ambiguous - ATA IDENTIFY DEVICE words 82-83 don't show if SMART supported.
SMART support is: Ambiguous - ATA IDENTIFY DEVICE words 85-87 don't show if SMART is enabled.
A mandatory SMART command failed: exiting. To continue, add one or more '-T permissive' options.

Verificacao concluida em 07-2025!
