
############################################################################
Device Model:     ADATA SU630
Serial Number:    2L5029SN8JEU
smartctl 7.1 2019-12-30 r5022 [x86_64-linux-5.4.0-216-generic] (local build)
Copyright (C) 2002-19, Bruce Allen, Christian Franke, www.smartmontools.org

=== START OF READ SMART DATA SECTION ===
SMART Attributes Data Structure revision number: 10
Vendor Specific SMART Attributes with Thresholds:
ID# ATTRIBUTE_NAME          FLAG     VALUE WORST THRESH TYPE      UPDATED  WHEN_FAILED RAW_VALUE
  1 Raw_Read_Error_Rate     0x002f   100   100   050    Pre-fail  Always       -       0
  5 Reallocated_Sector_Ct   0x0033   100   100   010    Pre-fail  Always       -       0
  9 Power_On_Hours          0x0032   100   100   000    Old_age   Always       -       27584
 12 Power_Cycle_Count       0x0032   100   100   000    Old_age   Always       -       119
160 Unknown_Attribute       0x0032   100   100   050    Old_age   Always       -       0
161 Unknown_Attribute       0x0032   100   100   050    Old_age   Always       -       100
163 Unknown_Attribute       0x0032   100   100   000    Old_age   Always       -       12
164 Unknown_Attribute       0x0032   100   100   000    Old_age   Always       -       71202
165 Unknown_Attribute       0x0032   100   100   000    Old_age   Always       -       118
166 Unknown_Attribute       0x0032   100   100   000    Old_age   Always       -       33
167 Unknown_Attribute       0x0032   100   100   000    Old_age   Always       -       99
148 Unknown_Attribute       0x0032   100   100   000    Old_age   Always       -       213608
149 Unknown_Attribute       0x0032   100   100   000    Old_age   Always       -       354
150 Unknown_Attribute       0x0032   100   100   000    Old_age   Always       -       100
151 Unknown_Attribute       0x0032   100   100   000    Old_age   Always       -       297
159 Unknown_Attribute       0x0032   100   100   000    Old_age   Always       -       0
168 Unknown_Attribute       0x0032   100   100   000    Old_age   Always       -       354
169 Unknown_Attribute       0x0032   100   100   000    Old_age   Always       -       98
177 Wear_Leveling_Count     0x0032   100   100   000    Old_age   Always       -       0
181 Program_Fail_Cnt_Total  0x0032   100   100   000    Old_age   Always       -       0
182 Erase_Fail_Count_Total  0x0032   100   100   000    Old_age   Always       -       0
192 Power-Off_Retract_Count 0x0032   100   100   000    Old_age   Always       -       89
194 Temperature_Celsius     0x0032   100   100   000    Old_age   Always       -       32
195 Hardware_ECC_Recovered  0x0032   100   100   000    Old_age   Always       -       0
196 Reallocated_Event_Count 0x0032   100   100   000    Old_age   Always       -       0
199 UDMA_CRC_Error_Count    0x0032   100   100   000    Old_age   Always       -       0
232 Available_Reservd_Space 0x0032   100   100   000    Old_age   Always       -       100
241 Total_LBAs_Written      0x0032   100   100   000    Old_age   Always       -       351459
242 Total_LBAs_Read         0x0032   100   100   000    Old_age   Always       -       364065
245 Unknown_Attribute       0x0032   100   100   000    Old_age   Always       -       463726


############################################################################
Model Family:     Seagate Barracuda 7200.14 (AF)
Device Model:     ST1000DM003-1ER162
Serial Number:    Z4Y3GK8E
smartctl 7.1 2019-12-30 r5022 [x86_64-linux-5.4.0-216-generic] (local build)
Copyright (C) 2002-19, Bruce Allen, Christian Franke, www.smartmontools.org

=== START OF READ SMART DATA SECTION ===
SMART Attributes Data Structure revision number: 10
Vendor Specific SMART Attributes with Thresholds:
ID# ATTRIBUTE_NAME          FLAG     VALUE WORST THRESH TYPE      UPDATED  WHEN_FAILED RAW_VALUE
  1 Raw_Read_Error_Rate     0x002f   114   099   006    Pre-fail  Always       -       83101584
  3 Spin_Up_Time            0x0023   097   097   000    Pre-fail  Always       -       0
  4 Start_Stop_Count        0x0032   099   099   020    Old_age   Always       -       1626
  5 Reallocated_Sector_Ct   0x0033   100   100   010    Pre-fail  Always       -       8
  7 Seek_Error_Rate         0x002f   083   060   030    Pre-fail  Always       -       225649347
  9 Power_On_Hours          0x0032   060   060   000    Old_age   Always       -       35671
 10 Spin_Retry_Count        0x0033   100   100   097    Pre-fail  Always       -       0
 12 Power_Cycle_Count       0x0032   099   099   020    Old_age   Always       -       1581
180 Unknown_HDD_Attribute   0x002a   100   100   000    Old_age   Always       -       1285494151
183 Runtime_Bad_Block       0x0032   100   100   000    Old_age   Always       -       0
184 End-to-End_Error        0x0033   100   100   097    Pre-fail  Always       -       0
187 Reported_Uncorrect      0x0032   099   099   000    Old_age   Always       -       1
188 Command_Timeout         0x0032   100   099   000    Old_age   Always       -       0 0 1
189 High_Fly_Writes         0x003a   098   098   000    Old_age   Always       -       2
190 Airflow_Temperature_Cel 0x0022   066   050   045    Old_age   Always       -       34 (Min/Max 32/38)
191 G-Sense_Error_Rate      0x0032   100   100   000    Old_age   Always       -       0
192 Power-Off_Retract_Count 0x0032   100   100   000    Old_age   Always       -       373
193 Load_Cycle_Count        0x0032   003   003   000    Old_age   Always       -       195009
194 Temperature_Celsius     0x0022   034   050   000    Old_age   Always       -       34 (0 12 0 0 0)
196 Reallocated_Event_Count 0x0032   100   100   036    Old_age   Always       -       8
197 Current_Pending_Sector  0x0032   100   100   000    Old_age   Always       -       0
198 Offline_Uncorrectable   0x0030   100   100   000    Old_age   Offline      -       0
199 UDMA_CRC_Error_Count    0x0032   200   200   000    Old_age   Always       -       0


############################################################################
Model Family:     Phison Driven SSDs
Device Model:     KINGSTON SA400S37240G
Serial Number:    50026B7785252E6E
smartctl 7.1 2019-12-30 r5022 [x86_64-linux-5.4.0-216-generic] (local build)
Copyright (C) 2002-19, Bruce Allen, Christian Franke, www.smartmontools.org

=== START OF READ SMART DATA SECTION ===
SMART Attributes Data Structure revision number: 1
Vendor Specific SMART Attributes with Thresholds:
ID# ATTRIBUTE_NAME          FLAG     VALUE WORST THRESH TYPE      UPDATED  WHEN_FAILED RAW_VALUE
  1 Raw_Read_Error_Rate     0x0032   100   100   000    Old_age   Always       -       100
  9 Power_On_Hours          0x0032   100   100   000    Old_age   Always       -       17965
 12 Power_Cycle_Count       0x0032   100   100   000    Old_age   Always       -       71
148 Unknown_Attribute       0x0000   100   100   000    Old_age   Offline      -       666
149 Unknown_Attribute       0x0000   100   100   000    Old_age   Offline      -       500
167 Write_Protect_Mode      0x0000   100   100   000    Old_age   Offline      -       0
168 SATA_Phy_Error_Count    0x0012   100   100   000    Old_age   Always       -       0
169 Bad_Block_Rate          0x0000   100   100   000    Old_age   Offline      -       0
170 Bad_Blk_Ct_Erl/Lat      0x0000   100   100   010    Old_age   Offline      -       0/0
172 Erase_Fail_Count        0x0032   100   100   000    Old_age   Always       -       0
173 MaxAvgErase_Ct          0x0000   100   100   000    Old_age   Offline      -       0
181 Program_Fail_Count      0x0032   100   100   000    Old_age   Always       -       0
182 Erase_Fail_Count        0x0000   100   100   000    Old_age   Offline      -       166
187 Reported_Uncorrect      0x0032   100   100   000    Old_age   Always       -       3
192 Unsafe_Shutdown_Count   0x0012   100   100   000    Old_age   Always       -       56
194 Temperature_Celsius     0x0022   026   051   000    Old_age   Always       -       26 (Min/Max 20/51)
196 Reallocated_Event_Count 0x0032   100   100   000    Old_age   Always       -       37
199 SATA_CRC_Error_Count    0x0032   100   100   000    Old_age   Always       -       0
218 CRC_Error_Count         0x0032   100   100   000    Old_age   Always       -       0
231 SSD_Life_Left           0x0000   072   072   000    Old_age   Offline      -       72
233 Flash_Writes_GiB        0x0032   100   100   000    Old_age   Always       -       53544
241 Lifetime_Writes_GiB     0x0032   100   100   000    Old_age   Always       -       21390
242 Lifetime_Reads_GiB      0x0032   100   100   000    Old_age   Always       -       36746
244 Average_Erase_Count     0x0000   100   100   000    Old_age   Offline      -       202
245 Max_Erase_Count         0x0000   100   100   000    Old_age   Offline      -       288
246 Total_Erase_Count       0x0000   100   100   000    Old_age   Offline      -       89713


############################################################################
Model Family:     Toshiba P300
Device Model:     TOSHIBA HDWD110
Serial Number:    214D49TFS
smartctl 7.1 2019-12-30 r5022 [x86_64-linux-5.4.0-216-generic] (local build)
Copyright (C) 2002-19, Bruce Allen, Christian Franke, www.smartmontools.org

=== START OF READ SMART DATA SECTION ===
SMART Attributes Data Structure revision number: 16
Vendor Specific SMART Attributes with Thresholds:
ID# ATTRIBUTE_NAME          FLAG     VALUE WORST THRESH TYPE      UPDATED  WHEN_FAILED RAW_VALUE
  1 Raw_Read_Error_Rate     0x000b   100   100   016    Pre-fail  Always       -       0
  2 Throughput_Performance  0x0005   141   141   054    Pre-fail  Offline      -       74
  3 Spin_Up_Time            0x0007   111   111   024    Pre-fail  Always       -       207 (Average 205)
  4 Start_Stop_Count        0x0012   100   100   000    Old_age   Always       -       181
  5 Reallocated_Sector_Ct   0x0033   100   100   005    Pre-fail  Always       -       0
  7 Seek_Error_Rate         0x000b   100   100   067    Pre-fail  Always       -       0
  8 Seek_Time_Performance   0x0005   118   118   020    Pre-fail  Offline      -       33
  9 Power_On_Hours          0x0012   096   096   000    Old_age   Always       -       31880
 10 Spin_Retry_Count        0x0013   100   100   060    Pre-fail  Always       -       0
 12 Power_Cycle_Count       0x0032   100   100   000    Old_age   Always       -       180
192 Power-Off_Retract_Count 0x0032   100   100   000    Old_age   Always       -       947
193 Load_Cycle_Count        0x0012   100   100   000    Old_age   Always       -       947
194 Temperature_Celsius     0x0002   162   162   000    Old_age   Always       -       37 (Min/Max 23/60)
196 Reallocated_Event_Count 0x0032   100   100   000    Old_age   Always       -       0
197 Current_Pending_Sector  0x0022   100   100   000    Old_age   Always       -       0
198 Offline_Uncorrectable   0x0008   100   100   000    Old_age   Offline      -       0
199 UDMA_CRC_Error_Count    0x000a   200   200   000    Old_age   Always       -       0


Verificacao concluida em 07-2025!
