
############################################################################
Device Model:     TOSHIBA HDWT720
Serial Number:    93R3S62TS89H
smartctl 7.4 2023-08-01 r5530 [x86_64-linux-6.8.0-62-generic] (local build)
Copyright (C) 2002-23, Bruce Allen, Christian Franke, www.smartmontools.org

=== START OF READ SMART DATA SECTION ===
SMART Attributes Data Structure revision number: 16
Vendor Specific SMART Attributes with Thresholds:
ID# ATTRIBUTE_NAME          FLAG     VALUE WORST THRESH TYPE      UPDATED  WHEN_FAILED RAW_VALUE
  1 Raw_Read_Error_Rate     0x000b   100   100   050    Pre-fail  Always       -       0
  2 Throughput_Performance  0x0005   100   100   050    Pre-fail  Offline      -       0
  3 Spin_Up_Time            0x0027   100   100   001    Pre-fail  Always       -       3161
  4 Start_Stop_Count        0x0032   100   100   000    Old_age   Always       -       19
  5 Reallocated_Sector_Ct   0x0033   100   100   050    Pre-fail  Always       -       0
  7 Seek_Error_Rate         0x000b   100   100   050    Pre-fail  Always       -       0
  8 Seek_Time_Performance   0x0005   100   100   050    Pre-fail  Offline      -       0
  9 Power_On_Hours          0x0032   099   099   000    Old_age   Always       -       465
 10 Spin_Retry_Count        0x0033   100   100   030    Pre-fail  Always       -       0
 12 Power_Cycle_Count       0x0032   100   100   000    Old_age   Always       -       18
191 G-Sense_Error_Rate      0x0032   100   100   000    Old_age   Always       -       0
192 Power-Off_Retract_Count 0x0032   100   100   000    Old_age   Always       -       14
193 Load_Cycle_Count        0x0032   100   100   000    Old_age   Always       -       26
194 Temperature_Celsius     0x0022   100   100   000    Old_age   Always       -       25 (Min/Max 17/32)
196 Reallocated_Event_Count 0x0032   100   100   000    Old_age   Always       -       0
197 Current_Pending_Sector  0x0032   100   100   000    Old_age   Always       -       0
198 Offline_Uncorrectable   0x0030   100   100   000    Old_age   Offline      -       0
199 UDMA_CRC_Error_Count    0x0032   200   253   000    Old_age   Always       -       0
220 Disk_Shift              0x0002   100   100   000    Old_age   Always       -       0
222 Loaded_Hours            0x0032   099   099   000    Old_age   Always       -       462
223 Load_Retry_Count        0x0032   100   100   000    Old_age   Always       -       0
224 Load_Friction           0x0022   100   100   000    Old_age   Always       -       0
226 Load-in_Time            0x0026   100   100   000    Old_age   Always       -       639
240 Head_Flying_Hours       0x0001   100   100   001    Pre-fail  Offline      -       0


############################################################################
Device Model:     TOSHIBA HDWT720
Serial Number:    93R3S63XS89H
smartctl 7.4 2023-08-01 r5530 [x86_64-linux-6.8.0-62-generic] (local build)
Copyright (C) 2002-23, Bruce Allen, Christian Franke, www.smartmontools.org

=== START OF READ SMART DATA SECTION ===
SMART Attributes Data Structure revision number: 16
Vendor Specific SMART Attributes with Thresholds:
ID# ATTRIBUTE_NAME          FLAG     VALUE WORST THRESH TYPE      UPDATED  WHEN_FAILED RAW_VALUE
  1 Raw_Read_Error_Rate     0x000b   100   100   050    Pre-fail  Always       -       0
  2 Throughput_Performance  0x0005   100   100   050    Pre-fail  Offline      -       0
  3 Spin_Up_Time            0x0027   100   100   001    Pre-fail  Always       -       3201
  4 Start_Stop_Count        0x0032   100   100   000    Old_age   Always       -       19
  5 Reallocated_Sector_Ct   0x0033   100   100   050    Pre-fail  Always       -       0
  7 Seek_Error_Rate         0x000b   100   100   050    Pre-fail  Always       -       0
  8 Seek_Time_Performance   0x0005   100   100   050    Pre-fail  Offline      -       0
  9 Power_On_Hours          0x0032   099   099   000    Old_age   Always       -       465
 10 Spin_Retry_Count        0x0033   100   100   030    Pre-fail  Always       -       0
 12 Power_Cycle_Count       0x0032   100   100   000    Old_age   Always       -       18
191 G-Sense_Error_Rate      0x0032   100   100   000    Old_age   Always       -       0
192 Power-Off_Retract_Count 0x0032   100   100   000    Old_age   Always       -       14
193 Load_Cycle_Count        0x0032   100   100   000    Old_age   Always       -       26
194 Temperature_Celsius     0x0022   100   100   000    Old_age   Always       -       25 (Min/Max 17/32)
196 Reallocated_Event_Count 0x0032   100   100   000    Old_age   Always       -       0
197 Current_Pending_Sector  0x0032   100   100   000    Old_age   Always       -       0
198 Offline_Uncorrectable   0x0030   100   100   000    Old_age   Offline      -       0
199 UDMA_CRC_Error_Count    0x0032   200   253   000    Old_age   Always       -       0
220 Disk_Shift              0x0002   100   100   000    Old_age   Always       -       0
222 Loaded_Hours            0x0032   099   099   000    Old_age   Always       -       462
223 Load_Retry_Count        0x0032   100   100   000    Old_age   Always       -       0
224 Load_Friction           0x0022   100   100   000    Old_age   Always       -       0
226 Load-in_Time            0x0026   100   100   000    Old_age   Always       -       737
240 Head_Flying_Hours       0x0001   100   100   001    Pre-fail  Offline      -       0


############################################################################
Model Number:                       Corsair MP600 PRO
Serial Number:                      A5ITB4434009WZ
smartctl 7.4 2023-08-01 r5530 [x86_64-linux-6.8.0-62-generic] (local build)
Copyright (C) 2002-23, Bruce Allen, Christian Franke, www.smartmontools.org

=== START OF SMART DATA SECTION ===
SMART/Health Information (NVMe Log 0x02)
Critical Warning:                   0x00
Temperature:                        40 Celsius
Available Spare:                    100%
Available Spare Threshold:          5%
Percentage Used:                    0%
Data Units Read:                    188,278 [96.3 GB]
Data Units Written:                 1,496,206 [766 GB]
Host Read Commands:                 2,220,912
Host Write Commands:                18,846,432
Controller Busy Time:               346
Power Cycles:                       28
Power On Hours:                     466
Unsafe Shutdowns:                   24
Media and Data Integrity Errors:    0
Error Information Log Entries:      45
Warning  Comp. Temperature Time:    0
Critical Comp. Temperature Time:    0


############################################################################
Model Number:                       Corsair MP600 PRO
Serial Number:                      A5ITB4434009WZ
smartctl 7.4 2023-08-01 r5530 [x86_64-linux-6.8.0-62-generic] (local build)
Copyright (C) 2002-23, Bruce Allen, Christian Franke, www.smartmontools.org

=== START OF SMART DATA SECTION ===
SMART/Health Information (NVMe Log 0x02)
Critical Warning:                   0x00
Temperature:                        40 Celsius
Available Spare:                    100%
Available Spare Threshold:          5%
Percentage Used:                    0%
Data Units Read:                    188,278 [96.3 GB]
Data Units Written:                 1,496,206 [766 GB]
Host Read Commands:                 2,220,912
Host Write Commands:                18,846,432
Controller Busy Time:               346
Power Cycles:                       28
Power On Hours:                     466
Unsafe Shutdowns:                   24
Media and Data Integrity Errors:    0
Error Information Log Entries:      47
Warning  Comp. Temperature Time:    0
Critical Comp. Temperature Time:    0


Verificacao concluida em 07-2025!
