
############################################################################
Device Model:     TOSHIBA HDWT720
Serial Number:    Y1C2S6QYS89H
smartctl 7.2 2020-12-30 r5155 [x86_64-linux-5.15.0-139-generic] (local build)
Copyright (C) 2002-20, Bruce Allen, Christian Franke, www.smartmontools.org

=== START OF READ SMART DATA SECTION ===
SMART Attributes Data Structure revision number: 16
Vendor Specific SMART Attributes with Thresholds:
ID# ATTRIBUTE_NAME          FLAG     VALUE WORST THRESH TYPE      UPDATED  WHEN_FAILED RAW_VALUE
  1 Raw_Read_Error_Rate     0x000b   100   100   050    Pre-fail  Always       -       0
  2 Throughput_Performance  0x0005   100   100   050    Pre-fail  Offline      -       0
  3 Spin_Up_Time            0x0027   100   100   001    Pre-fail  Always       -       2768
  4 Start_Stop_Count        0x0032   100   100   000    Old_age   Always       -       98
  5 Reallocated_Sector_Ct   0x0033   100   100   050    Pre-fail  Always       -       0
  7 Seek_Error_Rate         0x000b   100   100   050    Pre-fail  Always       -       0
  8 Seek_Time_Performance   0x0005   100   100   050    Pre-fail  Offline      -       0
  9 Power_On_Hours          0x0032   060   060   000    Old_age   Always       -       16368
 10 Spin_Retry_Count        0x0033   101   100   030    Pre-fail  Always       -       0
 12 Power_Cycle_Count       0x0032   100   100   000    Old_age   Always       -       97
191 G-Sense_Error_Rate      0x0032   100   100   000    Old_age   Always       -       0
192 Power-Off_Retract_Count 0x0032   100   100   000    Old_age   Always       -       79
193 Load_Cycle_Count        0x0032   100   100   000    Old_age   Always       -       105
194 Temperature_Celsius     0x0022   100   100   000    Old_age   Always       -       37 (Min/Max 15/50)
196 Reallocated_Event_Count 0x0032   100   100   000    Old_age   Always       -       0
197 Current_Pending_Sector  0x0032   100   100   000    Old_age   Always       -       0
198 Offline_Uncorrectable   0x0030   100   100   000    Old_age   Offline      -       0
199 UDMA_CRC_Error_Count    0x0032   200   253   000    Old_age   Always       -       0
220 Disk_Shift              0x0002   100   100   000    Old_age   Always       -       0
222 Loaded_Hours            0x0032   060   060   000    Old_age   Always       -       16367
223 Load_Retry_Count        0x0032   100   100   000    Old_age   Always       -       0
224 Load_Friction           0x0022   100   100   000    Old_age   Always       -       0
226 Load-in_Time            0x0026   100   100   000    Old_age   Always       -       630
240 Head_Flying_Hours       0x0001   100   100   001    Pre-fail  Offline      -       0


############################################################################
Model Number:                       ADATA SX8100NP
Serial Number:                      2K4629Q4QQYE
smartctl 7.2 2020-12-30 r5155 [x86_64-linux-5.15.0-139-generic] (local build)
Copyright (C) 2002-20, Bruce Allen, Christian Franke, www.smartmontools.org

=== START OF SMART DATA SECTION ===
SMART/Health Information (NVMe Log 0x02)
Critical Warning:                   0x00
Temperature:                        49 Celsius
Available Spare:                    100%
Available Spare Threshold:          32%
Percentage Used:                    5%
Data Units Read:                    51,565,966 [26.4 TB]
Data Units Written:                 48,802,554 [24.9 TB]
Host Read Commands:                 802,728,564
Host Write Commands:                593,956,577
Controller Busy Time:               0
Power Cycles:                       531
Power On Hours:                     23,280
Unsafe Shutdowns:                   190
Media and Data Integrity Errors:    113
Error Information Log Entries:      428
Warning  Comp. Temperature Time:    0
Critical Comp. Temperature Time:    0


Verificacao concluida em 06-2025!
