
############################################################################
Device Model:     [No Information Found]
Serial Number:    [No Information Found]
smartctl 7.2 2020-12-30 r5155 [x86_64-linux-5.15.0-133-generic] (local build)
Copyright (C) 2002-20, Bruce Allen, Christian Franke, www.smartmontools.org

Read Device Identity failed: scsi error unsupported field in scsi command

SMART support is: Ambiguous - ATA IDENTIFY DEVICE words 82-83 don't show if SMART supported.
SMART support is: Ambiguous - ATA IDENTIFY DEVICE words 85-87 don't show if SMART is enabled.
A mandatory SMART command failed: exiting. To continue, add one or more '-T permissive' options.

############################################################################
Model Family:     Western Digital Elements / My Passport (USB, AF)
Device Model:     WDC WD10JMVW-11AJGS4
Serial Number:    WD-WX61A16ENXJY
smartctl 7.2 2020-12-30 r5155 [x86_64-linux-5.15.0-133-generic] (local build)
Copyright (C) 2002-20, Bruce Allen, Christian Franke, www.smartmontools.org

=== START OF READ SMART DATA SECTION ===
SMART Attributes Data Structure revision number: 16
Vendor Specific SMART Attributes with Thresholds:
ID# ATTRIBUTE_NAME          FLAG     VALUE WORST THRESH TYPE      UPDATED  WHEN_FAILED RAW_VALUE
  1 Raw_Read_Error_Rate     0x002f   200   200   051    Pre-fail  Always       -       0
  3 Spin_Up_Time            0x0027   139   134   021    Pre-fail  Always       -       4050
  4 Start_Stop_Count        0x0032   100   100   000    Old_age   Always       -       452
  5 Reallocated_Sector_Ct   0x0033   200   200   140    Pre-fail  Always       -       0
  7 Seek_Error_Rate         0x002e   200   200   000    Old_age   Always       -       0
  9 Power_On_Hours          0x0032   077   076   000    Old_age   Always       -       17497
 10 Spin_Retry_Count        0x0032   100   100   000    Old_age   Always       -       0
 11 Calibration_Retry_Count 0x0032   100   100   000    Old_age   Always       -       0
 12 Power_Cycle_Count       0x0032   100   100   000    Old_age   Always       -       207
192 Power-Off_Retract_Count 0x0032   200   200   000    Old_age   Always       -       140
193 Load_Cycle_Count        0x0032   198   198   000    Old_age   Always       -       6264
194 Temperature_Celsius     0x0022   112   092   000    Old_age   Always       -       35
196 Reallocated_Event_Count 0x0032   200   200   000    Old_age   Always       -       0
197 Current_Pending_Sector  0x0032   200   200   000    Old_age   Always       -       0
198 Offline_Uncorrectable   0x0030   100   253   000    Old_age   Offline      -       0
199 UDMA_CRC_Error_Count    0x0032   200   200   000    Old_age   Always       -       0
200 Multi_Zone_Error_Rate   0x0008   100   253   000    Old_age   Offline      -       0


############################################################################
Model Family:     Phison Driven SSDs
Device Model:     KINGSTON SA400S37960G
Serial Number:    50026B7785CD7329
smartctl 7.2 2020-12-30 r5155 [x86_64-linux-5.15.0-133-generic] (local build)
Copyright (C) 2002-20, Bruce Allen, Christian Franke, www.smartmontools.org

=== START OF READ SMART DATA SECTION ===
SMART Attributes Data Structure revision number: 16
Vendor Specific SMART Attributes with Thresholds:
ID# ATTRIBUTE_NAME          FLAG     VALUE WORST THRESH TYPE      UPDATED  WHEN_FAILED RAW_VALUE
  1 Raw_Read_Error_Rate     0x0032   100   100   000    Old_age   Always       -       0
  9 Power_On_Hours          0x0032   100   100   000    Old_age   Always       -       1774
 12 Power_Cycle_Count       0x0032   100   100   000    Old_age   Always       -       3
148 Unknown_Attribute       0x0000   100   100   000    Old_age   Offline      -       0
149 Unknown_Attribute       0x0000   100   100   000    Old_age   Offline      -       0
167 Write_Protect_Mode      0x0000   100   100   000    Old_age   Offline      -       0
168 SATA_Phy_Error_Count    0x0012   100   100   000    Old_age   Always       -       0
169 Bad_Block_Rate          0x0000   100   100   000    Old_age   Offline      -       6
170 Bad_Blk_Ct_Lat/Erl      0x0000   100   100   010    Old_age   Offline      -       0/9
172 Erase_Fail_Count        0x0032   100   100   000    Old_age   Always       -       0
173 MaxAvgErase_Ct          0x0000   100   100   000    Old_age   Offline      -       6 (Average 3)
181 Program_Fail_Count      0x0032   100   100   000    Old_age   Always       -       0
182 Erase_Fail_Count        0x0000   100   100   000    Old_age   Offline      -       0
187 Reported_Uncorrect      0x0032   100   100   000    Old_age   Always       -       0
192 Unsafe_Shutdown_Count   0x0012   100   100   000    Old_age   Always       -       2
194 Temperature_Celsius     0x0022   037   053   000    Old_age   Always       -       37 (Min/Max 23/53)
196 Reallocated_Event_Count 0x0032   100   100   000    Old_age   Always       -       0
199 SATA_CRC_Error_Count    0x0032   100   100   000    Old_age   Always       -       196733
218 CRC_Error_Count         0x0032   100   100   000    Old_age   Always       -       0
231 SSD_Life_Left           0x0000   100   100   000    Old_age   Offline      -       100
233 Flash_Writes_GiB        0x0032   100   100   000    Old_age   Always       -       2748
241 Lifetime_Writes_GiB     0x0032   100   100   000    Old_age   Always       -       898
242 Lifetime_Reads_GiB      0x0032   100   100   000    Old_age   Always       -       2590
244 Average_Erase_Count     0x0000   100   100   000    Old_age   Offline      -       3
245 Max_Erase_Count         0x0000   100   100   000    Old_age   Offline      -       6
246 Total_Erase_Count       0x0000   100   100   000    Old_age   Offline      -       2960


############################################################################
Model Family:     Toshiba P300 (CMR)
Device Model:     TOSHIBA HDWD110
Serial Number:    11FNT06FS
smartctl 7.2 2020-12-30 r5155 [x86_64-linux-5.15.0-133-generic] (local build)
Copyright (C) 2002-20, Bruce Allen, Christian Franke, www.smartmontools.org

=== START OF READ SMART DATA SECTION ===
SMART Attributes Data Structure revision number: 16
Vendor Specific SMART Attributes with Thresholds:
ID# ATTRIBUTE_NAME          FLAG     VALUE WORST THRESH TYPE      UPDATED  WHEN_FAILED RAW_VALUE
  1 Raw_Read_Error_Rate     0x000b   100   100   016    Pre-fail  Always       -       0
  2 Throughput_Performance  0x0005   142   142   054    Pre-fail  Offline      -       70
  3 Spin_Up_Time            0x0007   122   122   024    Pre-fail  Always       -       177 (Average 198)
  4 Start_Stop_Count        0x0012   100   100   000    Old_age   Always       -       80
  5 Reallocated_Sector_Ct   0x0033   100   100   005    Pre-fail  Always       -       0
  7 Seek_Error_Rate         0x000b   100   100   067    Pre-fail  Always       -       0
  8 Seek_Time_Performance   0x0005   108   108   020    Pre-fail  Offline      -       37
  9 Power_On_Hours          0x0012   097   097   000    Old_age   Always       -       23639
 10 Spin_Retry_Count        0x0013   100   100   060    Pre-fail  Always       -       0
 12 Power_Cycle_Count       0x0032   100   100   000    Old_age   Always       -       80
192 Power-Off_Retract_Count 0x0032   100   100   000    Old_age   Always       -       373
193 Load_Cycle_Count        0x0012   100   100   000    Old_age   Always       -       373
194 Temperature_Celsius     0x0002   146   146   000    Old_age   Always       -       41 (Min/Max 25/63)
196 Reallocated_Event_Count 0x0032   100   100   000    Old_age   Always       -       0
197 Current_Pending_Sector  0x0022   100   100   000    Old_age   Always       -       8
198 Offline_Uncorrectable   0x0008   100   100   000    Old_age   Offline      -       0
199 UDMA_CRC_Error_Count    0x000a   200   200   000    Old_age   Always       -       3


############################################################################
Model Family:     Toshiba P300 (CMR)
Device Model:     TOSHIBA HDWD110
Serial Number:    11FNT0KFS
smartctl 7.2 2020-12-30 r5155 [x86_64-linux-5.15.0-133-generic] (local build)
Copyright (C) 2002-20, Bruce Allen, Christian Franke, www.smartmontools.org

=== START OF READ SMART DATA SECTION ===
SMART Attributes Data Structure revision number: 16
Vendor Specific SMART Attributes with Thresholds:
ID# ATTRIBUTE_NAME          FLAG     VALUE WORST THRESH TYPE      UPDATED  WHEN_FAILED RAW_VALUE
  1 Raw_Read_Error_Rate     0x000b   100   100   016    Pre-fail  Always       -       0
  2 Throughput_Performance  0x0005   143   143   054    Pre-fail  Offline      -       66
  3 Spin_Up_Time            0x0007   114   114   024    Pre-fail  Always       -       202 (Average 201)
  4 Start_Stop_Count        0x0012   100   100   000    Old_age   Always       -       290
  5 Reallocated_Sector_Ct   0x0033   100   100   005    Pre-fail  Always       -       0
  7 Seek_Error_Rate         0x000b   100   100   067    Pre-fail  Always       -       0
  8 Seek_Time_Performance   0x0005   115   115   020    Pre-fail  Offline      -       34
  9 Power_On_Hours          0x0012   096   096   000    Old_age   Always       -       28336
 10 Spin_Retry_Count        0x0013   100   100   060    Pre-fail  Always       -       0
 12 Power_Cycle_Count       0x0032   100   100   000    Old_age   Always       -       289
192 Power-Off_Retract_Count 0x0032   100   100   000    Old_age   Always       -       1022
193 Load_Cycle_Count        0x0012   100   100   000    Old_age   Always       -       1022
194 Temperature_Celsius     0x0002   146   146   000    Old_age   Always       -       41 (Min/Max 22/61)
196 Reallocated_Event_Count 0x0032   100   100   000    Old_age   Always       -       0
197 Current_Pending_Sector  0x0022   100   100   000    Old_age   Always       -       0
198 Offline_Uncorrectable   0x0008   100   100   000    Old_age   Offline      -       0
199 UDMA_CRC_Error_Count    0x000a   200   200   000    Old_age   Always       -       0


############################################################################
Model Family:     Phison Driven SSDs
Device Model:     KINGSTON SA400S37960G
Serial Number:    50026B7785CD7A7C
smartctl 7.2 2020-12-30 r5155 [x86_64-linux-5.15.0-133-generic] (local build)
Copyright (C) 2002-20, Bruce Allen, Christian Franke, www.smartmontools.org

=== START OF READ SMART DATA SECTION ===
SMART Attributes Data Structure revision number: 16
Vendor Specific SMART Attributes with Thresholds:
ID# ATTRIBUTE_NAME          FLAG     VALUE WORST THRESH TYPE      UPDATED  WHEN_FAILED RAW_VALUE
  1 Raw_Read_Error_Rate     0x0032   100   100   000    Old_age   Always       -       0
  9 Power_On_Hours          0x0032   100   100   000    Old_age   Always       -       1798
 12 Power_Cycle_Count       0x0032   100   100   000    Old_age   Always       -       4
148 Unknown_Attribute       0x0000   100   100   000    Old_age   Offline      -       0
149 Unknown_Attribute       0x0000   100   100   000    Old_age   Offline      -       0
167 Write_Protect_Mode      0x0000   100   100   000    Old_age   Offline      -       0
168 SATA_Phy_Error_Count    0x0012   100   100   000    Old_age   Always       -       0
169 Bad_Block_Rate          0x0000   100   100   000    Old_age   Offline      -       5
170 Bad_Blk_Ct_Lat/Erl      0x0000   100   100   010    Old_age   Offline      -       0/7
172 Erase_Fail_Count        0x0032   100   100   000    Old_age   Always       -       0
173 MaxAvgErase_Ct          0x0000   100   100   000    Old_age   Offline      -       5 (Average 3)
181 Program_Fail_Count      0x0032   100   100   000    Old_age   Always       -       0
182 Erase_Fail_Count        0x0000   100   100   000    Old_age   Offline      -       0
187 Reported_Uncorrect      0x0032   100   100   000    Old_age   Always       -       0
192 Unsafe_Shutdown_Count   0x0012   100   100   000    Old_age   Always       -       3
194 Temperature_Celsius     0x0022   032   048   000    Old_age   Always       -       31 (Min/Max 24/48)
196 Reallocated_Event_Count 0x0032   100   100   000    Old_age   Always       -       0
199 SATA_CRC_Error_Count    0x0032   100   100   000    Old_age   Always       -       196737
218 CRC_Error_Count         0x0032   100   100   000    Old_age   Always       -       0
231 SSD_Life_Left           0x0000   100   100   000    Old_age   Offline      -       100
233 Flash_Writes_GiB        0x0032   100   100   000    Old_age   Always       -       2777
241 Lifetime_Writes_GiB     0x0032   100   100   000    Old_age   Always       -       902
242 Lifetime_Reads_GiB      0x0032   100   100   000    Old_age   Always       -       2598
244 Average_Erase_Count     0x0000   100   100   000    Old_age   Offline      -       3
245 Max_Erase_Count         0x0000   100   100   000    Old_age   Offline      -       5
246 Total_Erase_Count       0x0000   100   100   000    Old_age   Offline      -       3028


############################################################################
Model Family:     Western Digital Blue (CMR)
Device Model:     WDC WD10EZEX-00WN4A0
Serial Number:    WD-WCC6Y4AD1HC3
smartctl 7.2 2020-12-30 r5155 [x86_64-linux-5.15.0-133-generic] (local build)
Copyright (C) 2002-20, Bruce Allen, Christian Franke, www.smartmontools.org

=== START OF READ SMART DATA SECTION ===
SMART Attributes Data Structure revision number: 16
Vendor Specific SMART Attributes with Thresholds:
ID# ATTRIBUTE_NAME          FLAG     VALUE WORST THRESH TYPE      UPDATED  WHEN_FAILED RAW_VALUE
  1 Raw_Read_Error_Rate     0x002f   200   200   051    Pre-fail  Always       -       0
  3 Spin_Up_Time            0x0027   175   173   021    Pre-fail  Always       -       2233
  4 Start_Stop_Count        0x0032   080   080   000    Old_age   Always       -       20675
  5 Reallocated_Sector_Ct   0x0033   200   200   140    Pre-fail  Always       -       0
  7 Seek_Error_Rate         0x002e   200   200   000    Old_age   Always       -       0
  9 Power_On_Hours          0x0032   041   040   000    Old_age   Always       -       43225
 10 Spin_Retry_Count        0x0032   100   100   000    Old_age   Always       -       0
 11 Calibration_Retry_Count 0x0032   100   100   000    Old_age   Always       -       0
 12 Power_Cycle_Count       0x0032   100   100   000    Old_age   Always       -       256
192 Power-Off_Retract_Count 0x0032   200   200   000    Old_age   Always       -       163
193 Load_Cycle_Count        0x0032   178   178   000    Old_age   Always       -       66995
194 Temperature_Celsius     0x0022   101   081   000    Old_age   Always       -       42
196 Reallocated_Event_Count 0x0032   200   200   000    Old_age   Always       -       0
197 Current_Pending_Sector  0x0032   200   200   000    Old_age   Always       -       0
198 Offline_Uncorrectable   0x0030   200   200   000    Old_age   Offline      -       0
199 UDMA_CRC_Error_Count    0x0032   200   199   000    Old_age   Always       -       428
200 Multi_Zone_Error_Rate   0x0008   200   200   000    Old_age   Offline      -       0


############################################################################
Model Family:     Seagate BarraCuda 3.5 (CMR)
Device Model:     ST1000DM010-2EP102
Serial Number:    ZN1P3VGN
smartctl 7.2 2020-12-30 r5155 [x86_64-linux-5.15.0-133-generic] (local build)
Copyright (C) 2002-20, Bruce Allen, Christian Franke, www.smartmontools.org

=== START OF READ SMART DATA SECTION ===
SMART Attributes Data Structure revision number: 10
Vendor Specific SMART Attributes with Thresholds:
ID# ATTRIBUTE_NAME          FLAG     VALUE WORST THRESH TYPE      UPDATED  WHEN_FAILED RAW_VALUE
  1 Raw_Read_Error_Rate     0x000f   080   063   006    Pre-fail  Always       -       106432328
  3 Spin_Up_Time            0x0003   097   097   000    Pre-fail  Always       -       0
  4 Start_Stop_Count        0x0032   100   100   020    Old_age   Always       -       671
  5 Reallocated_Sector_Ct   0x0033   100   100   010    Pre-fail  Always       -       0
  7 Seek_Error_Rate         0x000f   078   060   045    Pre-fail  Always       -       83614414
  9 Power_On_Hours          0x0032   081   081   000    Old_age   Always       -       16945
 10 Spin_Retry_Count        0x0013   100   100   097    Pre-fail  Always       -       0
 12 Power_Cycle_Count       0x0032   100   100   020    Old_age   Always       -       670
183 Runtime_Bad_Block       0x0032   099   099   000    Old_age   Always       -       1
184 End-to-End_Error        0x0032   100   100   099    Old_age   Always       -       0
187 Reported_Uncorrect      0x0032   100   100   000    Old_age   Always       -       0
188 Command_Timeout         0x0032   100   100   000    Old_age   Always       -       0 0 0
189 High_Fly_Writes         0x003a   100   100   000    Old_age   Always       -       0
190 Airflow_Temperature_Cel 0x0022   058   041   040    Old_age   Always       -       42 (Min/Max 29/51)
193 Load_Cycle_Count        0x0032   100   100   000    Old_age   Always       -       1346
194 Temperature_Celsius     0x0022   042   021   000    Old_age   Always       -       42 (0 21 0 0 0)
195 Hardware_ECC_Recovered  0x001a   029   001   000    Old_age   Always       -       106432328
197 Current_Pending_Sector  0x0012   100   100   000    Old_age   Always       -       0
198 Offline_Uncorrectable   0x0010   100   100   000    Old_age   Offline      -       0
199 UDMA_CRC_Error_Count    0x003e   200   200   000    Old_age   Always       -       0
240 Head_Flying_Hours       0x0000   100   253   000    Old_age   Offline      -       11871h+22m+17.437s
241 Total_LBAs_Written      0x0000   100   253   000    Old_age   Offline      -       34244685202
242 Total_LBAs_Read         0x0000   100   253   000    Old_age   Offline      -       44705250674


############################################################################
Model Number:                       WDC PC SN530 SDBPNPZ-512G-1014
Serial Number:                      2118HR474305
smartctl 7.2 2020-12-30 r5155 [x86_64-linux-5.15.0-133-generic] (local build)
Copyright (C) 2002-20, Bruce Allen, Christian Franke, www.smartmontools.org

=== START OF SMART DATA SECTION ===
SMART/Health Information (NVMe Log 0x02)
Critical Warning:                   0x00
Temperature:                        45 Celsius
Available Spare:                    100%
Available Spare Threshold:          10%
Percentage Used:                    3%
Data Units Read:                    42,580,995 [21.8 TB]
Data Units Written:                 36,054,288 [18.4 TB]
Host Read Commands:                 582,800,764
Host Write Commands:                589,977,851
Controller Busy Time:               1,770
Power Cycles:                       2,061
Power On Hours:                     2,599
Unsafe Shutdowns:                   43
Media and Data Integrity Errors:    0
Error Information Log Entries:      111
Warning  Comp. Temperature Time:    0
Critical Comp. Temperature Time:    0


Verificacao concluida em 06-2025!
