
############################################################################
Device Model:     LITEON CV8-CE128-HP
Serial Number:    0019202001LQ
smartctl 7.2 2020-12-30 r5155 [x86_64-linux-5.15.0-122-generic] (local build)
Copyright (C) 2002-20, Bruce Allen, Christian Franke, www.smartmontools.org

=== START OF READ SMART DATA SECTION ===
SMART Attributes Data Structure revision number: 1
Vendor Specific SMART Attributes with Thresholds:
ID# ATTRIBUTE_NAME          FLAG     VALUE WORST THRESH TYPE      UPDATED  WHEN_FAILED RAW_VALUE
  1 Raw_Read_Error_Rate     0x002f   100   100   050    Pre-fail  Always       -       0
  5 Reallocated_Sector_Ct   0x0033   100   100   005    Pre-fail  Always       -       0
  9 Power_On_Hours          0x0032   100   100   000    Old_age   Always       -       8977
 12 Power_Cycle_Count       0x0032   100   100   000    Old_age   Always       -       876
171 Unknown_Attribute       0x0032   100   100   000    Old_age   Always       -       0
172 Unknown_Attribute       0x0032   100   100   000    Old_age   Always       -       0
173 Unknown_Attribute       0x0032   072   072   005    Old_age   Always       -       562
174 Unknown_Attribute       0x0032   100   100   000    Old_age   Always       -       36
176 Erase_Fail_Count_Chip   0x0022   100   100   000    Old_age   Always       -       90
181 Program_Fail_Cnt_Total  0x0022   001   001   000    Old_age   Always       -       0
183 Runtime_Bad_Block       0x0032   100   100   000    Old_age   Always       -       0
184 End-to-End_Error        0x003b   100   100   097    Pre-fail  Always       -       0
187 Reported_Uncorrect      0x0032   100   100   000    Old_age   Always       -       0
188 Command_Timeout         0x0032   100   100   000    Old_age   Always       -       0
194 Temperature_Celsius     0x0022   040   053   000    Old_age   Always       -       40 (Min/Max 25/45)
198 Offline_Uncorrectable   0x0030   100   100   000    Old_age   Offline      -       0
199 UDMA_CRC_Error_Count    0x0032   100   100   000    Old_age   Always       -       0
201 Unknown_SSD_Attribute   0x0023   072   072   005    Pre-fail  Always       -       1438
241 Total_LBAs_Written      0x0032   100   100   000    Old_age   Always       -       1978496
242 Total_LBAs_Read         0x0032   100   100   000    Old_age   Always       -       7990294
243 Unknown_Attribute       0x0032   100   100   000    Old_age   Always       -       4728630


############################################################################
Model Family:     Seagate BarraCuda 3.5
Device Model:     ST4000DM004-2U9104
Serial Number:    ZFN4NWH3
smartctl 7.2 2020-12-30 r5155 [x86_64-linux-5.15.0-122-generic] (local build)
Copyright (C) 2002-20, Bruce Allen, Christian Franke, www.smartmontools.org

=== START OF READ SMART DATA SECTION ===
SMART Attributes Data Structure revision number: 10
Vendor Specific SMART Attributes with Thresholds:
ID# ATTRIBUTE_NAME          FLAG     VALUE WORST THRESH TYPE      UPDATED  WHEN_FAILED RAW_VALUE
  1 Raw_Read_Error_Rate     0x000f   074   064   006    Pre-fail  Always       -       26741240
  3 Spin_Up_Time            0x0003   096   096   000    Pre-fail  Always       -       0
  4 Start_Stop_Count        0x0032   100   100   020    Old_age   Always       -       27
  5 Reallocated_Sector_Ct   0x0033   100   100   010    Pre-fail  Always       -       0
  7 Seek_Error_Rate         0x000f   083   060   045    Pre-fail  Always       -       205485540
  9 Power_On_Hours          0x0032   084   084   000    Old_age   Always       -       14617 (85 173 0)
 10 Spin_Retry_Count        0x0013   100   100   097    Pre-fail  Always       -       0
 12 Power_Cycle_Count       0x0032   100   100   020    Old_age   Always       -       25
183 Runtime_Bad_Block       0x0032   100   100   000    Old_age   Always       -       0
184 End-to-End_Error        0x0032   100   100   099    Old_age   Always       -       0
187 Reported_Uncorrect      0x0032   100   100   000    Old_age   Always       -       0
188 Command_Timeout         0x0032   100   100   000    Old_age   Always       -       0 0 0
189 High_Fly_Writes         0x003a   100   100   000    Old_age   Always       -       0
190 Airflow_Temperature_Cel 0x0022   060   051   040    Old_age   Always       -       40 (Min/Max 34/48)
191 G-Sense_Error_Rate      0x0032   100   100   000    Old_age   Always       -       0
192 Power-Off_Retract_Count 0x0032   100   100   000    Old_age   Always       -       81
193 Load_Cycle_Count        0x0032   096   096   000    Old_age   Always       -       9365
194 Temperature_Celsius     0x0022   040   049   000    Old_age   Always       -       40 (0 29 0 0 0)
195 Hardware_ECC_Recovered  0x001a   074   064   000    Old_age   Always       -       26741240
197 Current_Pending_Sector  0x0012   100   100   000    Old_age   Always       -       0
198 Offline_Uncorrectable   0x0010   100   100   000    Old_age   Offline      -       0
199 UDMA_CRC_Error_Count    0x003e   200   200   000    Old_age   Always       -       0
240 Head_Flying_Hours       0x0000   100   253   000    Old_age   Offline      -       13473h+58m+23.587s
241 Total_LBAs_Written      0x0000   100   253   000    Old_age   Offline      -       13172419647
242 Total_LBAs_Read         0x0000   100   253   000    Old_age   Offline      -       60653062863


############################################################################
Model Family:     Seagate BarraCuda 3.5
Device Model:     ST4000DM004-2U9104
Serial Number:    ZW60F20M
smartctl 7.2 2020-12-30 r5155 [x86_64-linux-5.15.0-122-generic] (local build)
Copyright (C) 2002-20, Bruce Allen, Christian Franke, www.smartmontools.org

=== START OF READ SMART DATA SECTION ===
SMART Attributes Data Structure revision number: 10
Vendor Specific SMART Attributes with Thresholds:
ID# ATTRIBUTE_NAME          FLAG     VALUE WORST THRESH TYPE      UPDATED  WHEN_FAILED RAW_VALUE
  1 Raw_Read_Error_Rate     0x000f   083   064   006    Pre-fail  Always       -       191952248
  3 Spin_Up_Time            0x0003   096   096   000    Pre-fail  Always       -       0
  4 Start_Stop_Count        0x0032   100   100   020    Old_age   Always       -       27
  5 Reallocated_Sector_Ct   0x0033   100   100   010    Pre-fail  Always       -       0
  7 Seek_Error_Rate         0x000f   082   060   045    Pre-fail  Always       -       161927957
  9 Power_On_Hours          0x0032   084   084   000    Old_age   Always       -       14617 (58 178 0)
 10 Spin_Retry_Count        0x0013   100   100   097    Pre-fail  Always       -       0
 12 Power_Cycle_Count       0x0032   100   100   020    Old_age   Always       -       25
183 Runtime_Bad_Block       0x0032   100   100   000    Old_age   Always       -       0
184 End-to-End_Error        0x0032   100   100   099    Old_age   Always       -       0
187 Reported_Uncorrect      0x0032   100   100   000    Old_age   Always       -       0
188 Command_Timeout         0x0032   100   100   000    Old_age   Always       -       0 0 0
189 High_Fly_Writes         0x003a   100   100   000    Old_age   Always       -       0
190 Airflow_Temperature_Cel 0x0022   061   051   040    Old_age   Always       -       39 (Min/Max 34/49)
191 G-Sense_Error_Rate      0x0032   100   100   000    Old_age   Always       -       0
192 Power-Off_Retract_Count 0x0032   100   100   000    Old_age   Always       -       20
193 Load_Cycle_Count        0x0032   088   088   000    Old_age   Always       -       24738
194 Temperature_Celsius     0x0022   039   049   000    Old_age   Always       -       39 (0 29 0 0 0)
195 Hardware_ECC_Recovered  0x001a   083   064   000    Old_age   Always       -       191952248
197 Current_Pending_Sector  0x0012   100   100   000    Old_age   Always       -       0
198 Offline_Uncorrectable   0x0010   100   100   000    Old_age   Offline      -       0
199 UDMA_CRC_Error_Count    0x003e   200   200   000    Old_age   Always       -       0
240 Head_Flying_Hours       0x0000   100   253   000    Old_age   Offline      -       11462h+11m+23.143s
241 Total_LBAs_Written      0x0000   100   253   000    Old_age   Offline      -       30207858239
242 Total_LBAs_Read         0x0000   100   253   000    Old_age   Offline      -       11858576267


############################################################################
Device Model:     [No Information Found]
Serial Number:    [No Information Found]
smartctl 7.2 2020-12-30 r5155 [x86_64-linux-5.15.0-122-generic] (local build)
Copyright (C) 2002-20, Bruce Allen, Christian Franke, www.smartmontools.org

Read Device Identity failed: scsi error unsupported field in scsi command

SMART support is: Ambiguous - ATA IDENTIFY DEVICE words 82-83 don't show if SMART supported.
SMART support is: Ambiguous - ATA IDENTIFY DEVICE words 85-87 don't show if SMART is enabled.
A mandatory SMART command failed: exiting. To continue, add one or more '-T permissive' options.

Verificacao concluida em 06-2025!
