
############################################################################
Device Model:     Kingchuxing 128GB
Serial Number:    2023080702039
smartctl 7.2 2020-12-30 r5155 [x86_64-linux-5.15.0-136-generic] (local build)
Copyright (C) 2002-20, Bruce Allen, Christian Franke, www.smartmontools.org

=== START OF READ SMART DATA SECTION ===
SMART Attributes Data Structure revision number: 1
Vendor Specific SMART Attributes with Thresholds:
ID# ATTRIBUTE_NAME          FLAG     VALUE WORST THRESH TYPE      UPDATED  WHEN_FAILED RAW_VALUE
  1 Raw_Read_Error_Rate     0x0032   100   100   050    Old_age   Always       -       0
  5 Reallocated_Sector_Ct   0x0032   100   100   050    Old_age   Always       -       0
  9 Power_On_Hours          0x0032   100   100   050    Old_age   Always       -       13222
 12 Power_Cycle_Count       0x0032   100   100   050    Old_age   Always       -       73
160 Unknown_Attribute       0x0032   100   100   050    Old_age   Always       -       0
161 Unknown_Attribute       0x0033   100   100   050    Pre-fail  Always       -       100
163 Unknown_Attribute       0x0032   100   100   050    Old_age   Always       -       18
164 Unknown_Attribute       0x0032   100   100   050    Old_age   Always       -       60327
165 Unknown_Attribute       0x0032   100   100   050    Old_age   Always       -       189
166 Unknown_Attribute       0x0032   100   100   050    Old_age   Always       -       7
167 Unknown_Attribute       0x0032   100   100   050    Old_age   Always       -       124
168 Unknown_Attribute       0x0032   100   100   050    Old_age   Always       -       5050
169 Unknown_Attribute       0x0032   100   100   050    Old_age   Always       -       98
175 Program_Fail_Count_Chip 0x0032   100   100   050    Old_age   Always       -       0
176 Erase_Fail_Count_Chip   0x0032   100   100   050    Old_age   Always       -       0
177 Wear_Leveling_Count     0x0032   100   100   050    Old_age   Always       -       0
178 Used_Rsvd_Blk_Cnt_Chip  0x0032   100   100   050    Old_age   Always       -       0
181 Program_Fail_Cnt_Total  0x0032   100   100   050    Old_age   Always       -       0
182 Erase_Fail_Count_Total  0x0032   100   100   050    Old_age   Always       -       0
192 Power-Off_Retract_Count 0x0032   100   100   050    Old_age   Always       -       63
194 Temperature_Celsius     0x0022   100   100   050    Old_age   Always       -       40
195 Hardware_ECC_Recovered  0x0032   100   100   050    Old_age   Always       -       0
196 Reallocated_Event_Count 0x0032   100   100   050    Old_age   Always       -       0
197 Current_Pending_Sector  0x0032   100   100   050    Old_age   Always       -       0
198 Offline_Uncorrectable   0x0032   100   100   050    Old_age   Always       -       0
199 UDMA_CRC_Error_Count    0x0032   100   100   050    Old_age   Always       -       0
232 Available_Reservd_Space 0x0032   100   100   050    Old_age   Always       -       100
241 Total_LBAs_Written      0x0030   100   100   050    Old_age   Offline      -       273129
242 Total_LBAs_Read         0x0030   100   100   050    Old_age   Offline      -       60310
245 Unknown_Attribute       0x0032   100   100   050    Old_age   Always       -       187010


############################################################################
Model Family:     WD Blue / Red / Green SSDs
Device Model:     WDC WDS200T2G0A-00JH30
Serial Number:    232817800494
smartctl 7.2 2020-12-30 r5155 [x86_64-linux-5.15.0-136-generic] (local build)
Copyright (C) 2002-20, Bruce Allen, Christian Franke, www.smartmontools.org

=== START OF READ SMART DATA SECTION ===
SMART Attributes Data Structure revision number: 1
Vendor Specific SMART Attributes with Thresholds:
ID# ATTRIBUTE_NAME          FLAG     VALUE WORST THRESH TYPE      UPDATED  WHEN_FAILED RAW_VALUE
  5 Reallocated_Sector_Ct   0x0032   100   100   000    Old_age   Always       -       0
  9 Power_On_Hours          0x0032   100   100   000    Old_age   Always       -       13291
 12 Power_Cycle_Count       0x0032   100   100   000    Old_age   Always       -       66
165 Block_Erase_Count       0x0032   100   100   000    Old_age   Always       -       97
166 Minimum_PE_Cycles_TLC   0x0032   100   100   ---    Old_age   Always       -       1
167 Max_Bad_Blocks_per_Die  0x0032   100   100   ---    Old_age   Always       -       57
168 Maximum_PE_Cycles_TLC   0x0032   100   100   ---    Old_age   Always       -       3
169 Total_Bad_Blocks        0x0032   100   100   ---    Old_age   Always       -       1406
170 Grown_Bad_Blocks        0x0032   100   100   ---    Old_age   Always       -       0
171 Program_Fail_Count      0x0032   100   100   000    Old_age   Always       -       0
172 Erase_Fail_Count        0x0032   100   100   000    Old_age   Always       -       0
173 Average_PE_Cycles_TLC   0x0032   100   100   000    Old_age   Always       -       1
174 Unexpected_Power_Loss   0x0032   100   100   000    Old_age   Always       -       55
184 End-to-End_Error        0x0032   100   100   ---    Old_age   Always       -       0
187 Reported_Uncorrect      0x0032   100   100   000    Old_age   Always       -       0
188 Command_Timeout         0x0032   100   100   ---    Old_age   Always       -       0
194 Temperature_Celsius     0x0022   059   073   000    Old_age   Always       -       41 (Min/Max 19/73)
199 UDMA_CRC_Error_Count    0x0032   100   100   ---    Old_age   Always       -       0
230 Media_Wearout_Indicator 0x0032   100   100   000    Old_age   Always       -       0x001b0014001b
232 Available_Reservd_Space 0x0033   100   100   005    Pre-fail  Always       -       100
233 NAND_GB_Written_TLC     0x0032   100   100   ---    Old_age   Always       -       1343
234 NAND_GB_Written_SLC     0x0032   100   100   000    Old_age   Always       -       2642
241 Host_Writes_GiB         0x0030   100   100   000    Old_age   Offline      -       1141
242 Host_Reads_GiB          0x0030   100   100   000    Old_age   Offline      -       2610
244 Temp_Throttle_Status    0x0032   000   100   ---    Old_age   Always       -       0


############################################################################
Model Family:     Toshiba 2.5" HDD MQ04UBD...
Device Model:     TOSHIBA MQ04UBD200
Serial Number:    53NFT01TT
smartctl 7.2 2020-12-30 r5155 [x86_64-linux-5.15.0-136-generic] (local build)
Copyright (C) 2002-20, Bruce Allen, Christian Franke, www.smartmontools.org

=== START OF READ SMART DATA SECTION ===
SMART Attributes Data Structure revision number: 16
Vendor Specific SMART Attributes with Thresholds:
ID# ATTRIBUTE_NAME          FLAG     VALUE WORST THRESH TYPE      UPDATED  WHEN_FAILED RAW_VALUE
  1 Raw_Read_Error_Rate     0x000b   100   100   050    Pre-fail  Always       -       0
  2 Throughput_Performance  0x0005   100   100   050    Pre-fail  Offline      -       0
  3 Spin_Up_Time            0x0027   100   100   001    Pre-fail  Always       -       2190
  4 Start_Stop_Count        0x0032   100   100   000    Old_age   Always       -       3047
  5 Reallocated_Sector_Ct   0x0033   100   100   050    Pre-fail  Always       -       1
  7 Seek_Error_Rate         0x000b   100   100   050    Pre-fail  Always       -       0
  8 Seek_Time_Performance   0x0005   100   100   050    Pre-fail  Offline      -       0
  9 Power_On_Hours          0x0032   068   068   000    Old_age   Always       -       12966
 10 Spin_Retry_Count        0x0033   160   100   030    Pre-fail  Always       -       0
 12 Power_Cycle_Count       0x0032   100   100   000    Old_age   Always       -       30
191 G-Sense_Error_Rate      0x0032   100   100   000    Old_age   Always       -       17
192 Power-Off_Retract_Count 0x0032   100   100   000    Old_age   Always       -       12
193 Load_Cycle_Count        0x0032   100   100   000    Old_age   Always       -       4555
194 Temperature_Celsius     0x0022   100   100   000    Old_age   Always       -       29 (Min/Max 23/55)
196 Reallocated_Event_Count 0x0032   100   100   000    Old_age   Always       -       1
197 Current_Pending_Sector  0x0032   100   100   000    Old_age   Always       -       0
198 Offline_Uncorrectable   0x0030   100   100   000    Old_age   Offline      -       0
199 UDMA_CRC_Error_Count    0x0032   200   200   000    Old_age   Always       -       0
220 Disk_Shift              0x0002   100   100   000    Old_age   Always       -       0
222 Loaded_Hours            0x0032   100   100   000    Old_age   Always       -       269
223 Load_Retry_Count        0x0032   100   100   000    Old_age   Always       -       0
224 Load_Friction           0x0022   100   100   000    Old_age   Always       -       0
226 Load-in_Time            0x0026   100   100   000    Old_age   Always       -       277
240 Head_Flying_Hours       0x0001   100   100   001    Pre-fail  Offline      -       0


Verificacao concluida em 06-2025!
